s_id	sentence	target_tags	opinion_words_tags
1576	The display on this computer is the best I 've seen in a very long time , the battery life is very long and very convenient .	The\O display\O on\O this\O computer\O is\O the\O best\O I\O 've\O seen\O in\O a\O very\O long\O time\O ,\O the\O battery\B life\I is\O very\O long\O and\O very\O convenient\O .\O	The\O display\O on\O this\O computer\O is\O the\O best\O I\O 've\O seen\O in\O a\O very\O long\O time\O ,\O the\O battery\O life\O is\O very\O long\B and\O very\O convenient\B .\O
1409	But the quality , in general was less than the worth of the cheap laptop .	But\O the\O quality\B ,\O in\O general\O was\O less\O than\O the\O worth\O of\O the\O cheap\O laptop\O .\O	But\O the\O quality\O ,\O in\O general\O was\O less\B than\I the\I worth\I of\O the\O cheap\O laptop\O .\O
458	In the first moth of owning this computer its hardrive failed which had to be replaced .	In\O the\O first\O moth\O of\O owning\O this\O computer\O its\O hardrive\B failed\O which\O had\O to\O be\O replaced\O .\O	In\O the\O first\O moth\O of\O owning\O this\O computer\O its\O hardrive\O failed\B which\O had\O to\O be\O replaced\B .\O
1530	Its also FUN to use !	Its\O also\O FUN\O to\O use\B !\O	Its\O also\O FUN\B to\O use\O !\O
1612	The graphics and screen are stunning and although I was a PC person , I was able to understand how to use a mac fairly quickly .	The\O graphics\B and\O screen\O are\O stunning\O and\O although\O I\O was\O a\O PC\O person\O ,\O I\O was\O able\O to\O understand\O how\O to\O use\O a\O mac\O fairly\O quickly\O .\O	The\O graphics\O and\O screen\O are\O stunning\B and\O although\O I\O was\O a\O PC\O person\O ,\O I\O was\O able\O to\O understand\O how\O to\O use\O a\O mac\O fairly\O quickly\O .\O
1612	The graphics and screen are stunning and although I was a PC person , I was able to understand how to use a mac fairly quickly .	The\O graphics\O and\O screen\B are\O stunning\O and\O although\O I\O was\O a\O PC\O person\O ,\O I\O was\O able\O to\O understand\O how\O to\O use\O a\O mac\O fairly\O quickly\O .\O	The\O graphics\O and\O screen\O are\O stunning\B and\O although\O I\O was\O a\O PC\O person\O ,\O I\O was\O able\O to\O understand\O how\O to\O use\O a\O mac\O fairly\O quickly\O .\O
2273	WIth the upgraded memory , the MacBook Pro never has an issue running many many applications at once !	WIth\O the\O upgraded\B memory\I ,\O the\O MacBook\O Pro\O never\O has\O an\O issue\O running\O many\O many\O applications\O at\O once\O !\O	WIth\O the\O upgraded\O memory\O ,\O the\O MacBook\O Pro\O never\B has\I an\I issue\I running\O many\O many\O applications\O at\O once\O !\O
2824	Simple to use , and great graphics .	Simple\O to\O use\O ,\O and\O great\O graphics\B .\O	Simple\O to\O use\O ,\O and\O great\B graphics\O .\O
2824	Simple to use , and great graphics .	Simple\O to\O use\B ,\O and\O great\O graphics\O .\O	Simple\B to\O use\O ,\O and\O great\O graphics\O .\O
2934	The internet speed is spectacular .	The\O internet\B speed\I is\O spectacular\O .\O	The\O internet\O speed\O is\O spectacular\B .\O
624	They claim call center is still down .	They\O claim\O call\B center\I is\O still\O down\O .\O	They\O claim\O call\O center\O is\O still\O down\B .\O
2408	Mac also has many apps and programs that are quite cheap or free .	Mac\O also\O has\O many\O apps\B and\O programs\O that\O are\O quite\O cheap\O or\O free\O .\O	Mac\O also\O has\O many\O apps\O and\O programs\O that\O are\O quite\O cheap\B or\O free\B .\O
2408	Mac also has many apps and programs that are quite cheap or free .	Mac\O also\O has\O many\O apps\O and\O programs\B that\O are\O quite\O cheap\O or\O free\O .\O	Mac\O also\O has\O many\O apps\O and\O programs\O that\O are\O quite\O cheap\B or\O free\B .\O
2984	My husband uses it mostly for games , email and music .	My\O husband\O uses\O it\O mostly\O for\O games\B ,\O email\O and\O music\O .\O	My\O husband\O uses\O it\O mostly\B for\O games\O ,\O email\O and\O music\O .\O
2565	I just took the broken cords into the Apple store and they gave me new ones .	I\O just\O took\O the\O broken\O cords\B into\O the\O Apple\O store\O and\O they\O gave\O me\O new\O ones\O .\O	I\O just\O took\O the\O broken\B cords\O into\O the\O Apple\O store\O and\O they\O gave\O me\O new\O ones\O .\O
909	Apparently under the screen there are 2 little screws and when the screen gets moved back and forth , they come loose .	Apparently\O under\O the\O screen\B there\O are\O 2\O little\O screws\O and\O when\O the\O screen\O gets\O moved\O back\O and\O forth\O ,\O they\O come\O loose\O .\O	Apparently\O under\O the\O screen\O there\O are\O 2\O little\O screws\O and\O when\O the\O screen\O gets\O moved\O back\O and\O forth\O ,\O they\O come\O loose\B .\O
1747	Downfalls : sharp edges .	Downfalls\O :\O sharp\O edges\B .\O	Downfalls\B :\O sharp\B edges\O .\O
2322	The screen is gorgeous - yummy good .	The\O screen\B is\O gorgeous\O -\O yummy\O good\O .\O	The\O screen\O is\O gorgeous\B -\O yummy\O good\B .\O
941	I had it four months when my disc drive refused to open .	I\O had\O it\O four\O months\O when\O my\O disc\B drive\I refused\O to\O open\O .\O	I\O had\O it\O four\O months\O when\O my\O disc\O drive\O refused\B to\I open\I .\O
1154	So , after Apple replaced the hard drive I enjoyed another 4 months of my new computer , until it froze this morning -- completely .	So\O ,\O after\O Apple\O replaced\O the\O hard\B drive\I I\O enjoyed\O another\O 4\O months\O of\O my\O new\O computer\O ,\O until\O it\O froze\O this\O morning\O --\O completely\O .\O	So\O ,\O after\O Apple\O replaced\B the\O hard\O drive\O I\O enjoyed\B another\O 4\O months\O of\O my\O new\O computer\O ,\O until\O it\O froze\B this\O morning\O --\O completely\O .\O
1201	Once again , I was told it was the suspicious power supply problem .	Once\O again\O ,\O I\O was\O told\O it\O was\O the\O suspicious\O power\B supply\I problem\O .\O	Once\O again\O ,\O I\O was\O told\O it\O was\O the\O suspicious\B power\O supply\O problem\O .\O
1558	The Macbook starts fast , does n't crash , has a fantastic display , is small and light ( I have the 13.3 '' model ) , and is n't always complaining about updates , lost connections , errors , blue screens , etc .	The\O Macbook\O starts\O fast\O ,\O does\O n't\O crash\O ,\O has\O a\O fantastic\O display\B ,\O is\O small\O and\O light\O (\O I\O have\O the\O 13.3\O ''\O model\O )\O ,\O and\O is\O n't\O always\O complaining\O about\O updates\O ,\O lost\O connections\O ,\O errors\O ,\O blue\O screens\O ,\O etc\O .\O	The\O Macbook\O starts\O fast\O ,\O does\O n't\O crash\O ,\O has\O a\O fantastic\B display\O ,\O is\O small\O and\O light\O (\O I\O have\O the\O 13.3\O ''\O model\O )\O ,\O and\O is\O n't\O always\O complaining\O about\O updates\O ,\O lost\O connections\O ,\O errors\O ,\O blue\O screens\O ,\O etc\O .\O
1558	The Macbook starts fast , does n't crash , has a fantastic display , is small and light ( I have the 13.3 '' model ) , and is n't always complaining about updates , lost connections , errors , blue screens , etc .	The\O Macbook\O starts\B fast\O ,\O does\O n't\O crash\O ,\O has\O a\O fantastic\O display\O ,\O is\O small\O and\O light\O (\O I\O have\O the\O 13.3\O ''\O model\O )\O ,\O and\O is\O n't\O always\O complaining\O about\O updates\O ,\O lost\O connections\O ,\O errors\O ,\O blue\O screens\O ,\O etc\O .\O	The\O Macbook\O starts\O fast\B ,\O does\O n't\O crash\O ,\O has\O a\O fantastic\O display\O ,\O is\O small\O and\O light\O (\O I\O have\O the\O 13.3\O ''\O model\O )\O ,\O and\O is\O n't\O always\O complaining\O about\O updates\O ,\O lost\O connections\O ,\O errors\O ,\O blue\O screens\O ,\O etc\O .\O
462	Unable to boot up this brand new laptop .	Unable\O to\O boot\B up\I this\O brand\O new\O laptop\O .\O	Unable\B to\O boot\O up\O this\O brand\O new\O laptop\O .\O
2248	In addition , all the design tools on Pages and Keynotes makes it much easier to create professional looking documents and presentations .	In\O addition\O ,\O all\O the\O design\O tools\O on\O Pages\B and\O Keynotes\O makes\O it\O much\O easier\O to\O create\O professional\O looking\O documents\O and\O presentations\O .\O	In\O addition\O ,\O all\O the\O design\O tools\O on\O Pages\O and\O Keynotes\O makes\O it\O much\O easier\B to\O create\O professional\B looking\O documents\O and\O presentations\O .\O
2248	In addition , all the design tools on Pages and Keynotes makes it much easier to create professional looking documents and presentations .	In\O addition\O ,\O all\O the\O design\O tools\O on\O Pages\O and\O Keynotes\B makes\O it\O much\O easier\O to\O create\O professional\O looking\O documents\O and\O presentations\O .\O	In\O addition\O ,\O all\O the\O design\O tools\O on\O Pages\O and\O Keynotes\O makes\O it\O much\O easier\B to\O create\O professional\B looking\O documents\O and\O presentations\O .\O
1097	I actually had the hard drive replaced twice , the mother board once , the dvd drive twice , then they FINALLY agreed to replace it , ( ALL OF THIS IN LESS THAN 1 1/2 YEARS !	I\O actually\O had\O the\O hard\B drive\I replaced\O twice\O ,\O the\O mother\O board\O once\O ,\O the\O dvd\O drive\O twice\O ,\O then\O they\O FINALLY\O agreed\O to\O replace\O it\O ,\O (\O ALL\O OF\O THIS\O IN\O LESS\O THAN\O 1\O 1/2\O YEARS\O !\O	I\O actually\O had\O the\O hard\O drive\O replaced\B twice\O ,\O the\O mother\O board\O once\O ,\O the\O dvd\O drive\O twice\O ,\O then\O they\O FINALLY\O agreed\O to\O replace\O it\O ,\O (\O ALL\O OF\O THIS\O IN\O LESS\O THAN\O 1\O 1/2\O YEARS\O !\O
1097	I actually had the hard drive replaced twice , the mother board once , the dvd drive twice , then they FINALLY agreed to replace it , ( ALL OF THIS IN LESS THAN 1 1/2 YEARS !	I\O actually\O had\O the\O hard\O drive\O replaced\O twice\O ,\O the\O mother\B board\I once\O ,\O the\O dvd\O drive\O twice\O ,\O then\O they\O FINALLY\O agreed\O to\O replace\O it\O ,\O (\O ALL\O OF\O THIS\O IN\O LESS\O THAN\O 1\O 1/2\O YEARS\O !\O	I\O actually\O had\O the\O hard\O drive\O replaced\B twice\O ,\O the\O mother\O board\O once\O ,\O the\O dvd\O drive\O twice\O ,\O then\O they\O FINALLY\O agreed\O to\O replace\O it\O ,\O (\O ALL\O OF\O THIS\O IN\O LESS\O THAN\O 1\O 1/2\O YEARS\O !\O
1097	I actually had the hard drive replaced twice , the mother board once , the dvd drive twice , then they FINALLY agreed to replace it , ( ALL OF THIS IN LESS THAN 1 1/2 YEARS !	I\O actually\O had\O the\O hard\O drive\O replaced\O twice\O ,\O the\O mother\O board\O once\O ,\O the\O dvd\B drive\I twice\O ,\O then\O they\O FINALLY\O agreed\O to\O replace\O it\O ,\O (\O ALL\O OF\O THIS\O IN\O LESS\O THAN\O 1\O 1/2\O YEARS\O !\O	I\O actually\O had\O the\O hard\O drive\O replaced\B twice\O ,\O the\O mother\O board\O once\O ,\O the\O dvd\O drive\O twice\O ,\O then\O they\O FINALLY\O agreed\O to\O replace\O it\O ,\O (\O ALL\O OF\O THIS\O IN\O LESS\O THAN\O 1\O 1/2\O YEARS\O !\O
1308	The guy then said that if I insist on having the hinge tightened , they can do it for me but I have to accept the condition after the `` repair '' .	The\O guy\O then\O said\O that\O if\O I\O insist\O on\O having\O the\O hinge\B tightened\O ,\O they\O can\O do\O it\O for\O me\O but\O I\O have\O to\O accept\O the\O condition\O after\O the\O ``\O repair\O ''\O .\O	The\O guy\O then\O said\O that\O if\O I\O insist\O on\O having\O the\O hinge\O tightened\B ,\O they\O can\O do\O it\O for\O me\O but\O I\O have\O to\O accept\O the\O condition\O after\O the\O ``\O repair\O ''\O .\O
2477	I love the feel of the key board , as well as the trackpad .	I\O love\O the\O feel\O of\O the\O key\B board\I ,\O as\O well\O as\O the\O trackpad\O .\O	I\O love\B the\O feel\O of\O the\O key\O board\O ,\O as\O well\O as\O the\O trackpad\O .\O
2477	I love the feel of the key board , as well as the trackpad .	I\O love\O the\O feel\O of\O the\O key\O board\O ,\O as\O well\O as\O the\O trackpad\B .\O	I\O love\B the\O feel\O of\O the\O key\O board\O ,\O as\O well\O as\O the\O trackpad\O .\O
2226	Now I have the best of both worlds with all of the power and ease of the Mac !	Now\O I\O have\O the\O best\O of\O both\O worlds\O with\O all\O of\O the\O power\B and\O ease\O of\O the\O Mac\O !\O	Now\O I\O have\O the\O best\B of\O both\O worlds\O with\O all\O of\O the\O power\O and\O ease\O of\O the\O Mac\O !\O
2226	Now I have the best of both worlds with all of the power and ease of the Mac !	Now\O I\O have\O the\O best\O of\O both\O worlds\O with\O all\O of\O the\O power\O and\O ease\B of\O the\O Mac\O !\O	Now\O I\O have\O the\O best\B of\O both\O worlds\O with\O all\O of\O the\O power\O and\O ease\O of\O the\O Mac\O !\O
22	Ease of use is just one of the benefits I love about my Mac .	Ease\O of\O use\B is\O just\O one\O of\O the\O benefits\O I\O love\O about\O my\O Mac\O .\O	Ease\B of\O use\O is\O just\O one\O of\O the\O benefits\B I\O love\B about\O my\O Mac\O .\O
1216	Now the machine wo n't connect and Toshiba says that they did replace the connection card in May but they only warranty the repair for 30 days and now I 'm out of warranty even though this has been a constant 5 month occurance since I bought the netbook .	Now\O the\O machine\O wo\O n't\O connect\O and\O Toshiba\O says\O that\O they\O did\O replace\O the\O connection\B card\I in\O May\O but\O they\O only\O warranty\O the\O repair\O for\O 30\O days\O and\O now\O I\O 'm\O out\O of\O warranty\O even\O though\O this\O has\O been\O a\O constant\O 5\O month\O occurance\O since\O I\O bought\O the\O netbook\O .\O	Now\O the\O machine\O wo\O n't\O connect\O and\O Toshiba\O says\O that\O they\O did\O replace\B the\O connection\O card\O in\O May\O but\O they\O only\O warranty\O the\O repair\O for\O 30\O days\O and\O now\O I\O 'm\O out\O of\O warranty\O even\O though\O this\O has\O been\O a\O constant\O 5\O month\O occurance\O since\O I\O bought\O the\O netbook\O .\O
1684	Browsing , also , was no problem for me when I used itunes ( which usually slows down my PC ) .	Browsing\B ,\O also\O ,\O was\O no\O problem\O for\O me\O when\O I\O used\O itunes\O (\O which\O usually\O slows\O down\O my\O PC\O )\O .\O	Browsing\O ,\O also\O ,\O was\O no\B problem\I for\O me\O when\O I\O used\O itunes\O (\O which\O usually\O slows\O down\O my\O PC\O )\O .\O
2680	Again , decent comp for the price , and I was in need of one quickly as my other laptop died on me .	Again\O ,\O decent\O comp\O for\O the\O price\B ,\O and\O I\O was\O in\O need\O of\O one\O quickly\O as\O my\O other\O laptop\O died\O on\O me\O .\O	Again\O ,\O decent\B comp\O for\O the\O price\O ,\O and\O I\O was\O in\O need\O of\O one\O quickly\O as\O my\O other\O laptop\O died\O on\O me\O .\O
1401	so in a brief summary i would have to say that i would not recommend dell vostro 1000 to anyone due to it being a down right awful setup so in my opinion you should steer clear of them if you want a decent laptop .	so\O in\O a\O brief\O summary\O i\O would\O have\O to\O say\O that\O i\O would\O not\O recommend\O dell\O vostro\O 1000\O to\O anyone\O due\O to\O it\O being\O a\O down\O right\O awful\O setup\B so\O in\O my\O opinion\O you\O should\O steer\O clear\O of\O them\O if\O you\O want\O a\O decent\O laptop\O .\O	so\O in\O a\O brief\O summary\O i\O would\O have\O to\O say\O that\O i\O would\O not\O recommend\O dell\O vostro\O 1000\O to\O anyone\O due\O to\O it\O being\O a\O down\O right\O awful\B setup\O so\O in\O my\O opinion\O you\O should\O steer\O clear\O of\O them\O if\O you\O want\O a\O decent\O laptop\O .\O
1803	My friend just had to replace his entire motherboard , so did my wife , and it looks like I will have to as well .	My\O friend\O just\O had\O to\O replace\O his\O entire\O motherboard\B ,\O so\O did\O my\O wife\O ,\O and\O it\O looks\O like\O I\O will\O have\O to\O as\O well\O .\O	My\O friend\O just\O had\O to\O replace\B his\O entire\O motherboard\O ,\O so\O did\O my\O wife\O ,\O and\O it\O looks\O like\O I\O will\O have\O to\O as\O well\O .\O
1140	Toshiba customer services will indirectly deal with your problems by constantly tranferring you from one country to another , and I am not kidding you , I called different hours of the day and you 'll get someone else from another country trying to get you to tell them your life story all over again , since they make it sound like they do n't have your history list of your calls right in front of them .	Toshiba\B customer\I services\I will\O indirectly\O deal\O with\O your\O problems\O by\O constantly\O tranferring\O you\O from\O one\O country\O to\O another\O ,\O and\O I\O am\O not\O kidding\O you\O ,\O I\O called\O different\O hours\O of\O the\O day\O and\O you\O 'll\O get\O someone\O else\O from\O another\O country\O trying\O to\O get\O you\O to\O tell\O them\O your\O life\O story\O all\O over\O again\O ,\O since\O they\O make\O it\O sound\O like\O they\O do\O n't\O have\O your\O history\O list\O of\O your\O calls\O right\O in\O front\O of\O them\O .\O	Toshiba\O customer\O services\O will\O indirectly\B deal\O with\O your\O problems\O by\O constantly\O tranferring\O you\O from\O one\O country\O to\O another\O ,\O and\O I\O am\O not\O kidding\O you\O ,\O I\O called\O different\O hours\O of\O the\O day\O and\O you\O 'll\O get\O someone\O else\O from\O another\O country\O trying\O to\O get\O you\O to\O tell\O them\O your\O life\O story\O all\O over\O again\O ,\O since\O they\O make\O it\O sound\O like\O they\O do\O n't\O have\O your\O history\O list\O of\O your\O calls\O right\O in\O front\O of\O them\O .\O
2143	Quality Display I was surprised with the performance and quality of this HP Laptop .	Quality\B Display\I I\O was\O surprised\O with\O the\O performance\O and\O quality\O of\O this\O HP\O Laptop\O .\O	Quality\O Display\O I\O was\O surprised\B with\O the\O performance\O and\O quality\O of\O this\O HP\O Laptop\O .\O
2143	Quality Display I was surprised with the performance and quality of this HP Laptop .	Quality\O Display\O I\O was\O surprised\O with\O the\O performance\B and\O quality\O of\O this\O HP\O Laptop\O .\O	Quality\O Display\O I\O was\O surprised\B with\O the\O performance\O and\O quality\O of\O this\O HP\O Laptop\O .\O
2143	Quality Display I was surprised with the performance and quality of this HP Laptop .	Quality\O Display\O I\O was\O surprised\O with\O the\O performance\O and\O quality\B of\O this\O HP\O Laptop\O .\O	Quality\O Display\O I\O was\O surprised\B with\O the\O performance\O and\O quality\O of\O this\O HP\O Laptop\O .\O
1778	The battery life also does n't keep up with the claim but still I think macbook is much ahead from the rest of the pack .	The\O battery\B life\I also\O does\O n't\O keep\O up\O with\O the\O claim\O but\O still\O I\O think\O macbook\O is\O much\O ahead\O from\O the\O rest\O of\O the\O pack\O .\O	The\O battery\O life\O also\O does\B n't\I keep\O up\O with\O the\O claim\O but\O still\O I\O think\O macbook\O is\O much\B ahead\I from\O the\O rest\O of\O the\O pack\O .\O
1769	The internet capabilities are also very strong and picks up signals very easily .	The\O internet\B capabilities\I are\O also\O very\O strong\O and\O picks\O up\O signals\O very\O easily\O .\O	The\O internet\O capabilities\O are\O also\O very\O strong\B and\O picks\O up\O signals\O very\O easily\B .\O
2447	Its fast , has High definition quality in the videos .	Its\O fast\O ,\O has\O High\B definition\I quality\I in\O the\O videos\O .\O	Its\O fast\O ,\O has\O High\B definition\O quality\O in\O the\O videos\O .\O
2390	Speakers do n't get that loud , but good enough .	Speakers\B do\O n't\O get\O that\O loud\O ,\O but\O good\O enough\O .\O	Speakers\O do\B n't\I get\I that\I loud\I ,\O but\O good\B enough\O .\O
1676	Another Great thing is the Beast graphics .	Another\O Great\O thing\O is\O the\O Beast\B graphics\I .\O	Another\O Great\B thing\O is\O the\O Beast\O graphics\O .\O
27	The ease of set up was terrific .	The\O ease\O of\O set\B up\I was\O terrific\O .\O	The\O ease\B of\O set\O up\O was\O terrific\B .\O
2619	Everything I have tried has worked and I never have to carry the wall charger cause the battery is so awesome .	Everything\O I\O have\O tried\O has\O worked\O and\O I\O never\O have\O to\O carry\O the\O wall\O charger\O cause\O the\O battery\B is\O so\O awesome\O .\O	Everything\O I\O have\O tried\O has\O worked\O and\O I\O never\O have\O to\O carry\O the\O wall\O charger\O cause\O the\O battery\O is\O so\O awesome\B .\O
31	Screen is crystal clear , yes it 's small - but it 's a netbook !	Screen\B is\O crystal\O clear\O ,\O yes\O it\O 's\O small\O -\O but\O it\O 's\O a\O netbook\O !\O	Screen\O is\O crystal\B clear\I ,\O yes\O it\O 's\O small\B -\O but\O it\O 's\O a\O netbook\O !\O
2913	Screen size is perfect for portable use in any environment .	Screen\B size\I is\O perfect\O for\O portable\O use\O in\O any\O environment\O .\O	Screen\O size\O is\O perfect\B for\O portable\O use\O in\O any\O environment\O .\O
32	First , it does not have a push button to open the lid .	First\O ,\O it\O does\O not\O have\O a\O push\B button\I to\O open\O the\O lid\O .\O	First\O ,\O it\O does\B not\I have\O a\O push\O button\O to\O open\O the\O lid\O .\O
1626	I used to build my own desktops from the component parts , and recently my 7 year old Pentium 4 with HT 1 GB ram SATA desktop stopped working ( this was a rock star 7 years ago ) .	I\O used\O to\O build\O my\O own\O desktops\O from\O the\O component\O parts\O ,\O and\O recently\O my\O 7\O year\O old\O Pentium\B 4\I with\O HT\O 1\O GB\O ram\O SATA\O desktop\O stopped\O working\O (\O this\O was\O a\O rock\O star\O 7\O years\O ago\O )\O .\O	I\O used\O to\O build\O my\O own\O desktops\O from\O the\O component\O parts\O ,\O and\O recently\O my\O 7\O year\O old\O Pentium\O 4\O with\O HT\O 1\O GB\O ram\O SATA\O desktop\O stopped\B working\I (\O this\O was\O a\O rock\O star\O 7\O years\O ago\O )\O .\O
1626	I used to build my own desktops from the component parts , and recently my 7 year old Pentium 4 with HT 1 GB ram SATA desktop stopped working ( this was a rock star 7 years ago ) .	I\O used\O to\O build\O my\O own\O desktops\O from\O the\O component\O parts\O ,\O and\O recently\O my\O 7\O year\O old\O Pentium\O 4\O with\O HT\O 1\B GB\I ram\I SATA\O desktop\O stopped\O working\O (\O this\O was\O a\O rock\O star\O 7\O years\O ago\O )\O .\O	I\O used\O to\O build\O my\O own\O desktops\O from\O the\O component\O parts\O ,\O and\O recently\O my\O 7\O year\O old\O Pentium\O 4\O with\O HT\O 1\O GB\O ram\O SATA\O desktop\O stopped\B working\I (\O this\O was\O a\O rock\O star\O 7\O years\O ago\O )\O .\O
1184	) And printing from either word processor is an adventure .	)\O And\O printing\O from\O either\O word\B processor\I is\O an\O adventure\O .\O	)\O And\O printing\O from\O either\O word\O processor\O is\O an\O adventure\B .\O
2065	After purchasing this thing , I find out that I need a special interface device to connect my camera , and that it can not be purchased at the store - only on line .	After\O purchasing\O this\O thing\O ,\O I\O find\O out\O that\O I\O need\O a\O special\O interface\B device\I to\O connect\O my\O camera\O ,\O and\O that\O it\O can\O not\O be\O purchased\O at\O the\O store\O -\O only\O on\O line\O .\O	After\O purchasing\O this\O thing\O ,\O I\O find\O out\O that\O I\O need\O a\O special\B interface\O device\O to\O connect\O my\O camera\O ,\O and\O that\O it\O can\O not\O be\O purchased\O at\O the\O store\O -\O only\O on\O line\O .\O
1187	Another included program that is laughable is the chess game .	Another\O included\B program\I that\O is\O laughable\O is\O the\O chess\O game\O .\O	Another\O included\O program\O that\O is\O laughable\B is\O the\O chess\O game\O .\O
711	Yes , I thought the expese was a little much , but I now realize you get what you pay for .	Yes\O ,\O I\O thought\O the\O expese\B was\O a\O little\O much\O ,\O but\O I\O now\O realize\O you\O get\O what\O you\O pay\O for\O .\O	Yes\O ,\O I\O thought\O the\O expese\O was\O a\O little\O much\B ,\O but\O I\O now\O realize\O you\O get\O what\O you\O pay\O for\O .\O
2846	It works great for general internet use , Microsoft Office apps , home bookkeeping , etc .	It\O works\O great\O for\O general\O internet\O use\O ,\O Microsoft\B Office\I apps\I ,\O home\O bookkeeping\O ,\O etc\O .\O	It\O works\O great\B for\O general\O internet\O use\O ,\O Microsoft\O Office\O apps\O ,\O home\O bookkeeping\O ,\O etc\O .\O
2846	It works great for general internet use , Microsoft Office apps , home bookkeeping , etc .	It\O works\O great\O for\O general\O internet\B use\I ,\O Microsoft\O Office\O apps\O ,\O home\O bookkeeping\O ,\O etc\O .\O	It\O works\O great\B for\O general\O internet\O use\O ,\O Microsoft\O Office\O apps\O ,\O home\O bookkeeping\O ,\O etc\O .\O
2873	The price was very good , and the product is top quality .	The\O price\B was\O very\O good\O ,\O and\O the\O product\O is\O top\O quality\O .\O	The\O price\O was\O very\O good\B ,\O and\O the\O product\O is\O top\O quality\O .\O
2873	The price was very good , and the product is top quality .	The\O price\O was\O very\O good\O ,\O and\O the\O product\O is\O top\O quality\B .\O	The\O price\O was\O very\O good\O ,\O and\O the\O product\O is\O top\B quality\O .\O
653	It played various games without problems and ran aero smoothly and flawlessly .	It\O played\O various\O games\B without\O problems\O and\O ran\O aero\O smoothly\O and\O flawlessly\O .\O	It\O played\O various\O games\O without\B problems\I and\O ran\O aero\O smoothly\O and\O flawlessly\O .\O
653	It played various games without problems and ran aero smoothly and flawlessly .	It\O played\O various\O games\O without\O problems\O and\O ran\O aero\B smoothly\O and\O flawlessly\O .\O	It\O played\O various\O games\O without\O problems\O and\O ran\O aero\O smoothly\B and\O flawlessly\B .\O
