s_id	sentence	target_tags	opinion_words_tags
3064	The price is another driving influence that made me purchase this laptop .	The\O price\B is\O another\O driving\O influence\O that\O made\O me\O purchase\O this\O laptop\O .\O	The\O price\O is\O another\O driving\B influence\O that\O made\O me\O purchase\O this\O laptop\O .\O
2953	The Nortons virus scan is only for a very short time unlike others that usually are good for a year .	The\O Nortons\B virus\I scan\I is\O only\O for\O a\O very\O short\O time\O unlike\O others\O that\O usually\O are\O good\O for\O a\O year\O .\O	The\O Nortons\O virus\O scan\O is\O only\O for\O a\O very\O short\B time\O unlike\O others\O that\O usually\O are\O good\O for\O a\O year\O .\O
2129	It is stamped and not in pieces therefore it is a stronger more resilient frame .	It\O is\O stamped\O and\O not\O in\O pieces\O therefore\O it\O is\O a\O stronger\O more\O resilient\O frame\B .\O	It\O is\O stamped\O and\O not\O in\O pieces\O therefore\O it\O is\O a\O stronger\B more\O resilient\B frame\O .\O
2075	I am first time Mac Buyer and am amazed at features and ease of use the Mac offers .	I\O am\O first\O time\O Mac\O Buyer\O and\O am\O amazed\O at\O features\B and\O ease\O of\O use\O the\O Mac\O offers\O .\O	I\O am\O first\O time\O Mac\O Buyer\O and\O am\O amazed\B at\O features\O and\O ease\O of\O use\O the\O Mac\O offers\O .\O
2075	I am first time Mac Buyer and am amazed at features and ease of use the Mac offers .	I\O am\O first\O time\O Mac\O Buyer\O and\O am\O amazed\O at\O features\O and\O ease\O of\O use\B the\O Mac\O offers\O .\O	I\O am\O first\O time\O Mac\O Buyer\O and\O am\O amazed\O at\O features\O and\O ease\B of\O use\O the\O Mac\O offers\O .\O
2710	Came fully loaded - good .	Came\O fully\O loaded\B -\O good\O .\O	Came\O fully\B loaded\O -\O good\B .\O
1373	I noticed windows has a new system called Windows 7 , what about us Vista users ? They should get all the bugs out of Vista before investing in a new system .	I\O noticed\O windows\O has\O a\O new\O system\O called\O Windows\B 7\I ,\O what\O about\O us\O Vista\O users\O ?\O They\O should\O get\O all\O the\O bugs\O out\O of\O Vista\O before\O investing\O in\O a\O new\O system\O .\O	I\O noticed\O windows\O has\O a\O new\B system\O called\O Windows\O 7\O ,\O what\O about\O us\O Vista\O users\O ?\O They\O should\O get\O all\O the\O bugs\O out\O of\O Vista\O before\O investing\O in\O a\O new\O system\O .\O
1758	The only thing that I have , is the key broad is a little dark to see the letters , would help if it was a little lighter then it is .	The\O only\O thing\O that\O I\O have\O ,\O is\O the\O key\B broad\I is\O a\O little\O dark\O to\O see\O the\O letters\O ,\O would\O help\O if\O it\O was\O a\O little\O lighter\O then\O it\O is\O .\O	The\O only\O thing\O that\O I\O have\O ,\O is\O the\O key\O broad\O is\O a\O little\O dark\B to\O see\O the\O letters\O ,\O would\O help\O if\O it\O was\O a\O little\O lighter\O then\O it\O is\O .\O
36	This is the complete opposite to an ergonomic design .	This\O is\O the\O complete\O opposite\O to\O an\O ergonomic\O design\B .\O	This\O is\O the\O complete\O opposite\B to\O an\O ergonomic\B design\O .\O
2967	I would like at least a 4 hr . battery life .	I\O would\O like\O at\O least\O a\O 4\O hr\O .\O battery\B life\I .\O	I\O would\O like\B at\O least\O a\O 4\O hr\O .\O battery\O life\O .\O
1732	The only thing that I do n't like about my mac is that sometimes there are programs that I want to be able to run and I am not able to .	The\O only\O thing\O that\O I\O do\O n't\O like\O about\O my\O mac\O is\O that\O sometimes\O there\O are\O programs\B that\O I\O want\O to\O be\O able\O to\O run\O and\O I\O am\O not\O able\O to\O .\O	The\O only\O thing\O that\O I\O do\B n't\I like\I about\O my\O mac\O is\O that\O sometimes\O there\O are\O programs\O that\O I\O want\O to\O be\O able\O to\O run\O and\O I\O am\O not\B able\I to\O .\O
1063	Wireless has not been a issue for me , like some others have meantioned .	Wireless\B has\O not\O been\O a\O issue\O for\O me\O ,\O like\O some\O others\O have\O meantioned\O .\O	Wireless\O has\O not\B been\I a\I issue\I for\O me\O ,\O like\O some\O others\O have\O meantioned\O .\O
271	MacBook Notebooks quickly die out because of their short battery life , as well as the many background programs that run without the user 's knowlede .	MacBook\O Notebooks\O quickly\O die\O out\O because\O of\O their\O short\O battery\B life\I ,\O as\O well\O as\O the\O many\O background\O programs\O that\O run\O without\O the\O user\O 's\O knowlede\O .\O	MacBook\O Notebooks\O quickly\O die\O out\O because\O of\O their\O short\B battery\O life\O ,\O as\O well\O as\O the\O many\O background\O programs\O that\O run\O without\O the\O user\O 's\O knowlede\O .\O
271	MacBook Notebooks quickly die out because of their short battery life , as well as the many background programs that run without the user 's knowlede .	MacBook\O Notebooks\O quickly\O die\O out\O because\O of\O their\O short\O battery\O life\O ,\O as\O well\O as\O the\O many\O background\O programs\B that\O run\O without\O the\O user\O 's\O knowlede\O .\O	MacBook\O Notebooks\O quickly\O die\O out\O because\O of\O their\O short\O battery\O life\O ,\O as\O well\O as\O the\O many\O background\B programs\O that\O run\O without\O the\O user\O 's\O knowlede\O .\O
2478	All the things you can do with the trackpad make navigating around the computer and its programs so much simpler , quicker , and easier .	All\O the\O things\O you\O can\O do\O with\O the\O trackpad\B make\O navigating\O around\O the\O computer\O and\O its\O programs\O so\O much\O simpler\O ,\O quicker\O ,\O and\O easier\O .\O	All\O the\O things\O you\O can\O do\O with\O the\O trackpad\O make\O navigating\O around\O the\O computer\O and\O its\O programs\O so\O much\O simpler\B ,\O quicker\B ,\O and\O easier\B .\O
2478	All the things you can do with the trackpad make navigating around the computer and its programs so much simpler , quicker , and easier .	All\O the\O things\O you\O can\O do\O with\O the\O trackpad\O make\O navigating\B around\O the\O computer\O and\O its\O programs\O so\O much\O simpler\O ,\O quicker\O ,\O and\O easier\O .\O	All\O the\O things\O you\O can\O do\O with\O the\O trackpad\O make\O navigating\O around\O the\O computer\O and\O its\O programs\O so\O much\O simpler\B ,\O quicker\B ,\O and\O easier\B .\O
523	I guess the only good thing that came out of these were the speakers and the subwoofer .	I\O guess\O the\O only\O good\O thing\O that\O came\O out\O of\O these\O were\O the\O speakers\B and\O the\O subwoofer\O .\O	I\O guess\O the\O only\O good\B thing\O that\O came\O out\O of\O these\O were\O the\O speakers\O and\O the\O subwoofer\O .\O
523	I guess the only good thing that came out of these were the speakers and the subwoofer .	I\O guess\O the\O only\O good\O thing\O that\O came\O out\O of\O these\O were\O the\O speakers\O and\O the\O subwoofer\B .\O	I\O guess\O the\O only\O good\B thing\O that\O came\O out\O of\O these\O were\O the\O speakers\O and\O the\O subwoofer\O .\O
1657	Theres a built in camera with special effects- for video and photography .	Theres\O a\O built\B in\I camera\I with\O special\O effects-\O for\O video\O and\O photography\O .\O	Theres\O a\O built\O in\O camera\O with\O special\B effects-\O for\O video\O and\O photography\O .\O
1674	All for such a great price .	All\O for\O such\O a\O great\O price\B .\O	All\O for\O such\O a\O great\B price\O .\O
2927	Another thing is that after only a month the left mouse key broke and it costed $ 175 to send it in to fix it .	Another\O thing\O is\O that\O after\O only\O a\O month\O the\O left\B mouse\I key\I broke\O and\O it\O costed\O $\O 175\O to\O send\O it\O in\O to\O fix\O it\O .\O	Another\O thing\O is\O that\O after\O only\O a\O month\O the\O left\O mouse\O key\O broke\B and\O it\O costed\O $\O 175\O to\O send\O it\O in\O to\O fix\O it\O .\O
2993	It has good speed and plenty of hard drive space .	It\O has\O good\O speed\B and\O plenty\O of\O hard\O drive\O space\O .\O	It\O has\O good\B speed\O and\O plenty\O of\O hard\O drive\O space\O .\O
2993	It has good speed and plenty of hard drive space .	It\O has\O good\O speed\O and\O plenty\O of\O hard\B drive\I space\I .\O	It\O has\O good\O speed\O and\O plenty\B of\O hard\O drive\O space\O .\O
2453	Clear picture on it and everything .	Clear\O picture\B on\O it\O and\O everything\O .\O	Clear\B picture\O on\O it\O and\O everything\O .\O
2572	Very long-life battery ( up to 10-11 hours depending on how you configure power level settings ) .	Very\O long-life\O battery\B (\O up\O to\O 10-11\O hours\O depending\O on\O how\O you\O configure\O power\O level\O settings\O )\O .\O	Very\O long-life\B battery\O (\O up\O to\O 10-11\O hours\O depending\O on\O how\O you\O configure\O power\O level\O settings\O )\O .\O
2387	Screen is awesome , battery life is good .	Screen\B is\O awesome\O ,\O battery\O life\O is\O good\O .\O	Screen\O is\O awesome\B ,\O battery\O life\O is\O good\O .\O
2387	Screen is awesome , battery life is good .	Screen\O is\O awesome\O ,\O battery\B life\I is\O good\O .\O	Screen\O is\O awesome\O ,\O battery\O life\O is\O good\B .\O
2517	The black model also has a very nice seamless appearance - one of the better looking notebooks I 've seen .	The\O black\O model\O also\O has\O a\O very\O nice\O seamless\O appearance\B -\O one\O of\O the\O better\O looking\O notebooks\O I\O 've\O seen\O .\O	The\O black\O model\O also\O has\O a\O very\O nice\B seamless\B appearance\O -\O one\O of\O the\O better\O looking\O notebooks\O I\O 've\O seen\O .\O
990	The technical service for dell is so 3rd world it might as well not even bother .	The\O technical\B service\I for\I dell\I is\O so\O 3rd\O world\O it\O might\O as\O well\O not\O even\O bother\O .\O	The\O technical\O service\O for\O dell\O is\O so\O 3rd\B world\I it\O might\O as\O well\O not\O even\O bother\O .\O
1414	The graphics were awful and the warranty is n't even worth the cheap payment on the computer .	The\O graphics\B were\O awful\O and\O the\O warranty\O is\O n't\O even\O worth\O the\O cheap\O payment\O on\O the\O computer\O .\O	The\O graphics\O were\O awful\B and\O the\O warranty\O is\O n't\O even\O worth\O the\O cheap\O payment\O on\O the\O computer\O .\O
1414	The graphics were awful and the warranty is n't even worth the cheap payment on the computer .	The\O graphics\O were\O awful\O and\O the\O warranty\B is\O n't\O even\O worth\O the\O cheap\O payment\O on\O the\O computer\O .\O	The\O graphics\O were\O awful\O and\O the\O warranty\O is\B n't\I even\I worth\I the\O cheap\O payment\O on\O the\O computer\O .\O
903	They gave me a hard time yet again , but their was a malfunction in the battery itself , it did n't die .	They\O gave\O me\O a\O hard\O time\O yet\O again\O ,\O but\O their\O was\O a\O malfunction\O in\O the\O battery\B itself\O ,\O it\O did\O n't\O die\O .\O	They\O gave\O me\O a\O hard\O time\O yet\O again\O ,\O but\O their\O was\O a\O malfunction\B in\O the\O battery\O itself\O ,\O it\O did\O n't\O die\O .\O
1602	If you do n't feel comfortable doing it yourself , just buy the case and be happy , plus it looks nice , I bought the white one from Best Buy .	If\O you\O do\O n't\O feel\O comfortable\O doing\O it\O yourself\O ,\O just\O buy\O the\O case\B and\O be\O happy\O ,\O plus\O it\O looks\O nice\O ,\O I\O bought\O the\O white\O one\O from\O Best\O Buy\O .\O	If\O you\O do\O n't\O feel\O comfortable\O doing\O it\O yourself\O ,\O just\O buy\O the\O case\O and\O be\O happy\O ,\O plus\O it\O looks\O nice\B ,\O I\O bought\O the\O white\O one\O from\O Best\O Buy\O .\O
2828	Excellent speed for processing data .	Excellent\O speed\B for\O processing\O data\O .\O	Excellent\B speed\O for\O processing\O data\O .\O
2460	It has come into good use for my finances , scheduling , my parents business expenses , and it is definitely amazing for gaming .	It\O has\O come\O into\O good\O use\O for\O my\O finances\O ,\O scheduling\O ,\O my\O parents\O business\O expenses\O ,\O and\O it\O is\O definitely\O amazing\O for\O gaming\B .\O	It\O has\O come\O into\O good\O use\O for\O my\O finances\O ,\O scheduling\O ,\O my\O parents\O business\O expenses\O ,\O and\O it\O is\O definitely\O amazing\B for\O gaming\O .\O
2460	It has come into good use for my finances , scheduling , my parents business expenses , and it is definitely amazing for gaming .	It\O has\O come\O into\O good\O use\B for\O my\O finances\O ,\O scheduling\O ,\O my\O parents\O business\O expenses\O ,\O and\O it\O is\O definitely\O amazing\O for\O gaming\O .\O	It\O has\O come\O into\O good\B use\O for\O my\O finances\O ,\O scheduling\O ,\O my\O parents\O business\O expenses\O ,\O and\O it\O is\O definitely\O amazing\O for\O gaming\O .\O
2500	I was taught to use Photoshop and was amazed .	I\O was\O taught\O to\O use\O Photoshop\B and\O was\O amazed\O .\O	I\O was\O taught\O to\O use\O Photoshop\O and\O was\O amazed\B .\O
1252	Somehow the system clock got messed up after reboot .	Somehow\O the\O system\B clock\I got\O messed\O up\O after\O reboot\O .\O	Somehow\O the\O system\O clock\O got\O messed\B up\I after\O reboot\O .\O
1650	With the macbook pro it comes with free security software to protect it from viruses and other intrusive things from downloads and internet surfing or emails .	With\O the\O macbook\O pro\O it\O comes\O with\O free\O security\B software\I to\O protect\O it\O from\O viruses\O and\O other\O intrusive\O things\O from\O downloads\O and\O internet\O surfing\O or\O emails\O .\O	With\O the\O macbook\O pro\O it\O comes\O with\O free\B security\O software\O to\O protect\O it\O from\O viruses\O and\O other\O intrusive\O things\O from\O downloads\O and\O internet\O surfing\O or\O emails\O .\O
1037	The driver updates do n't fix the issue , very frustrating .	The\O driver\B updates\I do\O n't\O fix\O the\O issue\O ,\O very\O frustrating\O .\O	The\O driver\O updates\O do\O n't\O fix\O the\O issue\O ,\O very\O frustrating\B .\O
285	It doesnt work worth a damn .	It\O doesnt\O work\B worth\O a\O damn\O .\O	It\O doesnt\B work\O worth\O a\O damn\B .\O
3035	It works really well .	It\O works\B really\O well\O .\O	It\O works\O really\O well\B .\O
2511	Bigger HD , better graphics card , and a bid HD .	Bigger\O HD\B ,\O better\O graphics\O card\O ,\O and\O a\O bid\O HD\O .\O	Bigger\B HD\O ,\O better\O graphics\O card\O ,\O and\O a\O bid\O HD\O .\O
2511	Bigger HD , better graphics card , and a bid HD .	Bigger\O HD\O ,\O better\O graphics\O card\O ,\O and\O a\O bid\O HD\B .\O	Bigger\O HD\O ,\O better\O graphics\O card\O ,\O and\O a\O bid\B HD\O .\O
2511	Bigger HD , better graphics card , and a bid HD .	Bigger\O HD\O ,\O better\O graphics\B card\I ,\O and\O a\O bid\O HD\O .\O	Bigger\O HD\O ,\O better\B graphics\O card\O ,\O and\O a\O bid\O HD\O .\O
2275	The built in camera is very useful when chatting with other techs in remote buildings on our campus .	The\O built\B in\I camera\I is\O very\O useful\O when\O chatting\O with\O other\O techs\O in\O remote\O buildings\O on\O our\O campus\O .\O	The\O built\O in\O camera\O is\O very\O useful\B when\O chatting\O with\O other\O techs\O in\O remote\O buildings\O on\O our\O campus\O .\O
781	The DVD burner broke after burning 3 DVD 'd during that time !	The\O DVD\B burner\I broke\O after\O burning\O 3\O DVD\O 'd\O during\O that\O time\O !\O	The\O DVD\O burner\O broke\B after\O burning\O 3\O DVD\O 'd\O during\O that\O time\O !\O
2987	It works fine with our wireless and they 've had not problems .	It\O works\B fine\O with\O our\O wireless\O and\O they\O 've\O had\O not\O problems\O .\O	It\O works\O fine\B with\O our\O wireless\O and\O they\O 've\O had\O not\O problems\O .\O
1364	Product support very poor as each phone call costs me long distan	Product\B support\I very\O poor\O as\O each\O phone\O call\O costs\O me\O long\O distan\O	Product\O support\O very\O poor\B as\O each\O phone\O call\O costs\O me\O long\O distan\O
2787	Overall the computer is very easy to use , the screen is perfect , great computer , my daughter loves .	Overall\O the\O computer\O is\O very\O easy\O to\O use\O ,\O the\O screen\B is\O perfect\O ,\O great\O computer\O ,\O my\O daughter\O loves\O .\O	Overall\O the\O computer\O is\O very\O easy\O to\O use\O ,\O the\O screen\O is\O perfect\B ,\O great\O computer\O ,\O my\O daughter\O loves\O .\O
2787	Overall the computer is very easy to use , the screen is perfect , great computer , my daughter loves .	Overall\O the\O computer\O is\O very\O easy\O to\O use\B ,\O the\O screen\O is\O perfect\O ,\O great\O computer\O ,\O my\O daughter\O loves\O .\O	Overall\O the\O computer\O is\O very\O easy\B to\O use\O ,\O the\O screen\O is\O perfect\O ,\O great\O computer\O ,\O my\O daughter\O loves\O .\O
948	The casing of the power cord fried and shocked my husband when he pulled it out of the socket .	The\O casing\B of\I the\I power\I cord\I fried\O and\O shocked\O my\O husband\O when\O he\O pulled\O it\O out\O of\O the\O socket\O .\O	The\O casing\O of\O the\O power\O cord\O fried\B and\O shocked\O my\O husband\O when\O he\O pulled\O it\O out\O of\O the\O socket\O .\O
2049	It does not keep internet signals no matter where you bring it .	It\O does\O not\O keep\O internet\B signals\I no\O matter\O where\O you\O bring\O it\O .\O	It\O does\O not\B keep\I internet\O signals\O no\O matter\O where\O you\O bring\O it\O .\O
2988	It 's a great product for a great price !	It\O 's\O a\O great\O product\O for\O a\O great\O price\B !\O	It\O 's\O a\O great\O product\O for\O a\O great\B price\O !\O
1646	But see the macbook pro is different because it may have a huge price tag but it comes with the full software that you would actually need and most of it has free future updates .	But\O see\O the\O macbook\O pro\O is\O different\O because\O it\O may\O have\O a\O huge\O price\B tag\I but\O it\O comes\O with\O the\O full\O software\O that\O you\O would\O actually\O need\O and\O most\O of\O it\O has\O free\O future\O updates\O .\O	But\O see\O the\O macbook\O pro\O is\O different\O because\O it\O may\O have\O a\O huge\B price\O tag\O but\O it\O comes\O with\O the\O full\O software\O that\O you\O would\O actually\O need\O and\O most\O of\O it\O has\O free\O future\O updates\O .\O
1646	But see the macbook pro is different because it may have a huge price tag but it comes with the full software that you would actually need and most of it has free future updates .	But\O see\O the\O macbook\O pro\O is\O different\O because\O it\O may\O have\O a\O huge\O price\O tag\O but\O it\O comes\O with\O the\O full\O software\B that\O you\O would\O actually\O need\O and\O most\O of\O it\O has\O free\O future\O updates\O .\O	But\O see\O the\O macbook\O pro\O is\O different\O because\O it\O may\O have\O a\O huge\O price\O tag\O but\O it\O comes\O with\O the\O full\B software\O that\O you\O would\O actually\O need\O and\O most\O of\O it\O has\O free\O future\O updates\O .\O
1646	But see the macbook pro is different because it may have a huge price tag but it comes with the full software that you would actually need and most of it has free future updates .	But\O see\O the\O macbook\O pro\O is\O different\O because\O it\O may\O have\O a\O huge\O price\O tag\O but\O it\O comes\O with\O the\O full\O software\O that\O you\O would\O actually\O need\O and\O most\O of\O it\O has\O free\O future\O updates\B .\O	But\O see\O the\O macbook\O pro\O is\O different\O because\O it\O may\O have\O a\O huge\O price\O tag\O but\O it\O comes\O with\O the\O full\O software\O that\O you\O would\O actually\O need\O and\O most\O of\O it\O has\O free\B future\O updates\O .\O
2505	and the multiple page viewer ( allows you to press one button to see every separate page currently opened at the same time in one screen ) are great for those who are working non stop or just shopping online .	and\O the\O multiple\B page\I viewer\I (\O allows\O you\O to\O press\O one\O button\O to\O see\O every\O separate\O page\O currently\O opened\O at\O the\O same\O time\O in\O one\O screen\O )\O are\O great\O for\O those\O who\O are\O working\O non\O stop\O or\O just\O shopping\O online\O .\O	and\O the\O multiple\O page\O viewer\O (\O allows\O you\O to\O press\O one\O button\O to\O see\O every\O separate\O page\O currently\O opened\O at\O the\O same\O time\O in\O one\O screen\O )\O are\O great\B for\O those\O who\O are\O working\O non\O stop\O or\O just\O shopping\O online\O .\O
214	Keyboard good sized and easy to use .	Keyboard\B good\O sized\O and\O easy\O to\O use\O .\O	Keyboard\O good\B sized\I and\O easy\B to\I use\I .\O
214	Keyboard good sized and easy to use .	Keyboard\O good\O sized\O and\O easy\O to\O use\B .\O	Keyboard\O good\O sized\O and\O easy\B to\O use\O .\O
1263	HP said it was out of warranty .	HP\O said\O it\O was\O out\O of\O warranty\B .\O	HP\O said\O it\O was\O out\B of\I warranty\O .\O
2947	wonderful features .	wonderful\O features\B .\O	wonderful\B features\O .\O
2451	Im glad that it has such great features in it .	Im\O glad\O that\O it\O has\O such\O great\O features\B in\O it\O .\O	Im\O glad\O that\O it\O has\O such\O great\B features\O in\O it\O .\O
314	I like those programs better than Office and you can save your files to be completely compatible with the Office programs as well .	I\O like\O those\O programs\B better\O than\O Office\O and\O you\O can\O save\O your\O files\O to\O be\O completely\O compatible\O with\O the\O Office\O programs\O as\O well\O .\O	I\O like\B those\O programs\O better\B than\O Office\O and\O you\O can\O save\O your\O files\O to\O be\O completely\O compatible\O with\O the\O Office\O programs\O as\O well\O .\O
314	I like those programs better than Office and you can save your files to be completely compatible with the Office programs as well .	I\O like\O those\O programs\O better\O than\O Office\O and\O you\O can\O save\O your\O files\O to\O be\O completely\O compatible\O with\O the\O Office\B programs\I as\O well\O .\O	I\O like\O those\O programs\O better\O than\O Office\O and\O you\O can\O save\O your\O files\O to\O be\O completely\O compatible\B with\O the\O Office\O programs\O as\O well\O .\O
2777	Great wifi too .	Great\O wifi\B too\O .\O	Great\B wifi\O too\O .\O
1085	WHEN TYPING , LETTERS AND SPACES ARE FREQUENTLY OMITTED REQUIRING THE USER TO REDO MANY WORDS AND SENTENCES .	WHEN\O TYPING\B ,\O LETTERS\O AND\O SPACES\O ARE\O FREQUENTLY\O OMITTED\O REQUIRING\O THE\O USER\O TO\O REDO\O MANY\O WORDS\O AND\O SENTENCES\O .\O	WHEN\O TYPING\O ,\O LETTERS\O AND\O SPACES\O ARE\O FREQUENTLY\O OMITTED\B REQUIRING\O THE\O USER\O TO\O REDO\O MANY\O WORDS\O AND\O SENTENCES\O .\O
1906	Only a few days after I received the computer back , the screen froze again .	Only\O a\O few\O days\O after\O I\O received\O the\O computer\O back\O ,\O the\O screen\B froze\O again\O .\O	Only\O a\O few\O days\O after\O I\O received\O the\O computer\O back\O ,\O the\O screen\O froze\B again\O .\O
124	It is not ideal for children because of the temp .	It\O is\O not\O ideal\O for\O children\O because\O of\O the\O temp\B .\O	It\O is\O not\B ideal\I for\O children\O because\O of\O the\O temp\O .\O
732	Although i do believe that Windows operating system may be to fault for some of the problems .	Although\O i\O do\O believe\O that\O Windows\B operating\I system\I may\O be\O to\O fault\O for\O some\O of\O the\O problems\O .\O	Although\O i\O do\O believe\O that\O Windows\O operating\O system\O may\O be\O to\O fault\B for\O some\O of\O the\O problems\O .\O
3011	Great OS , fabulous improvements to the existing line bumping up the processor speed and adding the thunderbolt port .	Great\O OS\B ,\O fabulous\O improvements\O to\O the\O existing\O line\O bumping\O up\O the\O processor\O speed\O and\O adding\O the\O thunderbolt\O port\O .\O	Great\B OS\O ,\O fabulous\B improvements\O to\O the\O existing\O line\O bumping\O up\O the\O processor\O speed\O and\O adding\O the\O thunderbolt\O port\O .\O
3011	Great OS , fabulous improvements to the existing line bumping up the processor speed and adding the thunderbolt port .	Great\O OS\O ,\O fabulous\O improvements\O to\O the\O existing\O line\O bumping\O up\O the\O processor\B speed\I and\O adding\O the\O thunderbolt\O port\O .\O	Great\O OS\O ,\O fabulous\B improvements\O to\O the\O existing\O line\O bumping\O up\O the\O processor\O speed\O and\O adding\O the\O thunderbolt\O port\O .\O
3011	Great OS , fabulous improvements to the existing line bumping up the processor speed and adding the thunderbolt port .	Great\O OS\O ,\O fabulous\O improvements\O to\O the\O existing\O line\O bumping\O up\O the\O processor\O speed\O and\O adding\O the\O thunderbolt\B port\I .\O	Great\O OS\O ,\O fabulous\O improvements\O to\O the\O existing\O line\O bumping\O up\O the\O processor\O speed\O and\O adding\B the\O thunderbolt\O port\O .\O
1842	The lcd screen stopped working on mine after 10 months .	The\O lcd\B screen\I stopped\O working\O on\O mine\O after\O 10\O months\O .\O	The\O lcd\O screen\O stopped\B working\O on\O mine\O after\O 10\O months\O .\O
205	Images are crisp and clean .	Images\B are\O crisp\O and\O clean\O .\O	Images\O are\O crisp\B and\O clean\B .\O
1398	although its windows vista compared to windows xp sucks .	although\O its\O windows\B vista\I compared\O to\O windows\O xp\O sucks\O .\O	although\O its\O windows\O vista\O compared\O to\O windows\O xp\O sucks\B .\O
