s_id	sentence	target_tags	opinion_words_tags
1288	We carry the netbook around here and there , hence it 's kinda of irritating when the LCD just `` slide '' downwards .	We\O carry\O the\O netbook\O around\O here\O and\O there\O ,\O hence\O it\O 's\O kinda\O of\O irritating\O when\O the\O LCD\B just\O ``\O slide\O ''\O downwards\O .\O	We\O carry\O the\O netbook\O around\O here\O and\O there\O ,\O hence\O it\O 's\O kinda\O of\O irritating\B when\O the\O LCD\O just\O ``\O slide\O ''\O downwards\O .\O
2959	The 2 GB of RAM is plenty , able to run Windows 7 and at least 2 or 3 other programs with next to no slowdown .	The\O 2\B GB\I of\I RAM\I is\O plenty\O ,\O able\O to\O run\O Windows\O 7\O and\O at\O least\O 2\O or\O 3\O other\O programs\O with\O next\O to\O no\O slowdown\O .\O	The\O 2\O GB\O of\O RAM\O is\O plenty\B ,\O able\O to\O run\O Windows\O 7\O and\O at\O least\O 2\O or\O 3\O other\O programs\O with\O next\O to\O no\O slowdown\O .\O
2959	The 2 GB of RAM is plenty , able to run Windows 7 and at least 2 or 3 other programs with next to no slowdown .	The\O 2\O GB\O of\O RAM\O is\O plenty\O ,\O able\O to\O run\O Windows\B 7\I and\O at\O least\O 2\O or\O 3\O other\O programs\O with\O next\O to\O no\O slowdown\O .\O	The\O 2\O GB\O of\O RAM\O is\O plenty\O ,\O able\B to\O run\O Windows\O 7\O and\O at\O least\O 2\O or\O 3\O other\O programs\O with\O next\O to\O no\O slowdown\O .\O
2959	The 2 GB of RAM is plenty , able to run Windows 7 and at least 2 or 3 other programs with next to no slowdown .	The\O 2\O GB\O of\O RAM\O is\O plenty\O ,\O able\O to\O run\O Windows\O 7\O and\O at\O least\O 2\O or\O 3\O other\O programs\B with\O next\O to\O no\O slowdown\O .\O	The\O 2\O GB\O of\O RAM\O is\O plenty\O ,\O able\B to\O run\O Windows\O 7\O and\O at\O least\O 2\O or\O 3\O other\O programs\O with\O next\O to\O no\O slowdown\O .\O
26	The battery life is amazing , the versitility is outstanding .	The\O battery\B life\I is\O amazing\O ,\O the\O versitility\O is\O outstanding\O .\O	The\O battery\O life\O is\O amazing\B ,\O the\O versitility\O is\O outstanding\O .\O
26	The battery life is amazing , the versitility is outstanding .	The\O battery\O life\O is\O amazing\O ,\O the\O versitility\B is\O outstanding\O .\O	The\O battery\O life\O is\O amazing\O ,\O the\O versitility\O is\O outstanding\B .\O
264	Vista is a nightmare .	Vista\B is\O a\O nightmare\O .\O	Vista\O is\O a\O nightmare\B .\O
2214	The program came with the computer and works beautifully .	The\O program\B came\O with\O the\O computer\O and\O works\O beautifully\O .\O	The\O program\O came\O with\O the\O computer\O and\O works\O beautifully\B .\O
1221	I was loving this Netbook because it had an amazing screen and display and was small and light , but after 1 week it stopped openning web pages for me ( even after installing new browsers ) then eventually it just started giving me a blue screen and crashing everytime I booted it .	I\O was\O loving\O this\O Netbook\O because\O it\O had\O an\O amazing\O screen\B and\O display\O and\O was\O small\O and\O light\O ,\O but\O after\O 1\O week\O it\O stopped\O openning\O web\O pages\O for\O me\O (\O even\O after\O installing\O new\O browsers\O )\O then\O eventually\O it\O just\O started\O giving\O me\O a\O blue\O screen\O and\O crashing\O everytime\O I\O booted\O it\O .\O	I\O was\O loving\O this\O Netbook\O because\O it\O had\O an\O amazing\B screen\O and\O display\O and\O was\O small\O and\O light\O ,\O but\O after\O 1\O week\O it\O stopped\O openning\O web\O pages\O for\O me\O (\O even\O after\O installing\O new\O browsers\O )\O then\O eventually\O it\O just\O started\O giving\O me\O a\O blue\O screen\O and\O crashing\O everytime\O I\O booted\O it\O .\O
1221	I was loving this Netbook because it had an amazing screen and display and was small and light , but after 1 week it stopped openning web pages for me ( even after installing new browsers ) then eventually it just started giving me a blue screen and crashing everytime I booted it .	I\O was\O loving\O this\O Netbook\O because\O it\O had\O an\O amazing\O screen\O and\O display\B and\O was\O small\O and\O light\O ,\O but\O after\O 1\O week\O it\O stopped\O openning\O web\O pages\O for\O me\O (\O even\O after\O installing\O new\O browsers\O )\O then\O eventually\O it\O just\O started\O giving\O me\O a\O blue\O screen\O and\O crashing\O everytime\O I\O booted\O it\O .\O	I\O was\O loving\O this\O Netbook\O because\O it\O had\O an\O amazing\O screen\O and\O display\O and\O was\O small\B and\O light\B ,\O but\O after\O 1\O week\O it\O stopped\O openning\O web\O pages\O for\O me\O (\O even\O after\O installing\O new\O browsers\O )\O then\O eventually\O it\O just\O started\O giving\O me\O a\O blue\O screen\O and\O crashing\O everytime\O I\O booted\O it\O .\O
1221	I was loving this Netbook because it had an amazing screen and display and was small and light , but after 1 week it stopped openning web pages for me ( even after installing new browsers ) then eventually it just started giving me a blue screen and crashing everytime I booted it .	I\O was\O loving\O this\O Netbook\O because\O it\O had\O an\O amazing\O screen\O and\O display\O and\O was\O small\O and\O light\O ,\O but\O after\O 1\O week\O it\O stopped\O openning\O web\O pages\O for\O me\O (\O even\O after\O installing\O new\O browsers\B )\O then\O eventually\O it\O just\O started\O giving\O me\O a\O blue\O screen\O and\O crashing\O everytime\O I\O booted\O it\O .\O	I\O was\O loving\O this\O Netbook\O because\O it\O had\O an\O amazing\O screen\O and\O display\O and\O was\O small\O and\O light\O ,\O but\O after\O 1\O week\O it\O stopped\O openning\O web\O pages\O for\O me\O (\O even\O after\O installing\O new\B browsers\O )\O then\O eventually\O it\O just\O started\O giving\O me\O a\O blue\O screen\O and\O crashing\O everytime\O I\O booted\O it\O .\O
1237	The So called laptop Runs to Slow and I hate it !	The\O So\O called\O laptop\O Runs\B to\O Slow\O and\O I\O hate\O it\O !\O	The\O So\O called\O laptop\O Runs\O to\O Slow\B and\O I\O hate\B it\O !\O
359	Charger seems large for this class of computer .	Charger\B seems\O large\O for\O this\O class\O of\O computer\O .\O	Charger\O seems\O large\B for\O this\O class\O of\O computer\O .\O
2690	I dislike the quality and the placement of the speakers .	I\O dislike\O the\O quality\O and\O the\O placement\O of\O the\O speakers\B .\O	I\O dislike\B the\O quality\O and\O the\O placement\O of\O the\O speakers\O .\O
2713	The screen graphics and clarity , and sharpness are great .	The\O screen\B graphics\I and\O clarity\O ,\O and\O sharpness\O are\O great\O .\O	The\O screen\O graphics\O and\O clarity\O ,\O and\O sharpness\O are\O great\B .\O
2713	The screen graphics and clarity , and sharpness are great .	The\O screen\O graphics\O and\O clarity\B ,\O and\O sharpness\O are\O great\O .\O	The\O screen\O graphics\O and\O clarity\O ,\O and\O sharpness\O are\O great\B .\O
2713	The screen graphics and clarity , and sharpness are great .	The\O screen\O graphics\O and\O clarity\O ,\O and\O sharpness\B are\O great\O .\O	The\O screen\O graphics\O and\O clarity\O ,\O and\O sharpness\O are\O great\B .\O
2071	So I called customer support ( which is good too ) and they went through it and it is just a safety feature and it does not affect performance at all , I just chose to hide the message .	So\O I\O called\O customer\B support\I (\O which\O is\O good\O too\O )\O and\O they\O went\O through\O it\O and\O it\O is\O just\O a\O safety\O feature\O and\O it\O does\O not\O affect\O performance\O at\O all\O ,\O I\O just\O chose\O to\O hide\O the\O message\O .\O	So\O I\O called\O customer\O support\O (\O which\O is\O good\B too\O )\O and\O they\O went\O through\O it\O and\O it\O is\O just\O a\O safety\O feature\O and\O it\O does\O not\O affect\O performance\O at\O all\O ,\O I\O just\O chose\O to\O hide\O the\O message\O .\O
2071	So I called customer support ( which is good too ) and they went through it and it is just a safety feature and it does not affect performance at all , I just chose to hide the message .	So\O I\O called\O customer\O support\O (\O which\O is\O good\O too\O )\O and\O they\O went\O through\O it\O and\O it\O is\O just\O a\O safety\O feature\O and\O it\O does\O not\O affect\O performance\B at\O all\O ,\O I\O just\O chose\O to\O hide\O the\O message\O .\O	So\O I\O called\O customer\O support\O (\O which\O is\O good\O too\O )\O and\O they\O went\O through\O it\O and\O it\O is\O just\O a\O safety\O feature\O and\O it\O does\O not\B affect\I performance\O at\O all\O ,\O I\O just\O chose\O to\O hide\O the\O message\O .\O
2348	The unibody design is edgy and durable .	The\O unibody\B design\I is\O edgy\O and\O durable\O .\O	The\O unibody\O design\O is\O edgy\B and\O durable\B .\O
1441	STOPPED BOOTING UP less than a week after my one-year warranty was up .	STOPPED\O BOOTING\B UP\I less\O than\O a\O week\O after\O my\O one-year\O warranty\O was\O up\O .\O	STOPPED\B BOOTING\O UP\O less\O than\O a\O week\O after\O my\O one-year\O warranty\O was\O up\O .\O
1441	STOPPED BOOTING UP less than a week after my one-year warranty was up .	STOPPED\O BOOTING\O UP\O less\O than\O a\O week\O after\O my\O one-year\B warranty\I was\O up\O .\O	STOPPED\O BOOTING\O UP\O less\O than\O a\O week\O after\O my\O one-year\O warranty\O was\O up\B .\O
2860	But , for the cost this is a winner .	But\O ,\O for\O the\O cost\B this\O is\O a\O winner\O .\O	But\O ,\O for\O the\O cost\O this\O is\O a\O winner\B .\O
817	Also , the battery does not last very long at all .	Also\O ,\O the\O battery\B does\O not\O last\O very\O long\O at\O all\O .\O	Also\O ,\O the\O battery\O does\O not\O last\O very\O long\B at\O all\O .\O
427	I bought it from HSN because it was `` bundled '' with extra software , but as it turns out , that software just crashes it more often ... ..	I\O bought\O it\O from\O HSN\O because\O it\O was\O ``\O bundled\O ''\O with\O extra\O software\O ,\O but\O as\O it\O turns\O out\O ,\O that\O software\B just\O crashes\O it\O more\O often\O ...\O ..\O	I\O bought\O it\O from\O HSN\O because\O it\O was\O ``\O bundled\O ''\O with\O extra\O software\O ,\O but\O as\O it\O turns\O out\O ,\O that\O software\O just\O crashes\B it\O more\O often\O ...\O ..\O
1139	I constantly had to send my laptop in for services every 3 months and it always seems to be the same problem that they said they had already fixed .	I\O constantly\O had\O to\O send\O my\O laptop\O in\O for\O services\B every\O 3\O months\O and\O it\O always\O seems\O to\O be\O the\O same\O problem\O that\O they\O said\O they\O had\O already\O fixed\O .\O	I\O constantly\O had\O to\O send\O my\O laptop\O in\O for\O services\O every\O 3\O months\O and\O it\O always\O seems\O to\O be\O the\O same\O problem\B that\O they\O said\O they\O had\O already\O fixed\O .\O
1591	Strong performance in this device makes use of fun and a strong sense of the era of speed This device serves all modern requirements is a very strong game and is very useful for designers .	Strong\O performance\B in\O this\O device\O makes\O use\O of\O fun\O and\O a\O strong\O sense\O of\O the\O era\O of\O speed\O This\O device\O serves\O all\O modern\O requirements\O is\O a\O very\O strong\O game\O and\O is\O very\O useful\O for\O designers\O .\O	Strong\O performance\O in\O this\O device\O makes\O use\O of\O fun\O and\O a\O strong\B sense\O of\O the\O era\O of\O speed\O This\O device\O serves\O all\O modern\O requirements\O is\O a\O very\O strong\O game\O and\O is\O very\O useful\O for\O designers\O .\O
536	I was sorely disapointed to discover that HP ( what I thought was a reputable company ) would n't honor the warrenty when the fan blade fell apart .	I\O was\O sorely\O disapointed\O to\O discover\O that\O HP\O (\O what\O I\O thought\O was\O a\O reputable\O company\O )\O would\O n't\O honor\O the\O warrenty\B when\O the\O fan\O blade\O fell\O apart\O .\O	I\O was\O sorely\B disapointed\I to\O discover\O that\O HP\O (\O what\O I\O thought\O was\O a\O reputable\O company\O )\O would\O n't\O honor\O the\O warrenty\O when\O the\O fan\O blade\O fell\O apart\O .\O
536	I was sorely disapointed to discover that HP ( what I thought was a reputable company ) would n't honor the warrenty when the fan blade fell apart .	I\O was\O sorely\O disapointed\O to\O discover\O that\O HP\O (\O what\O I\O thought\O was\O a\O reputable\O company\O )\O would\O n't\O honor\O the\O warrenty\O when\O the\O fan\B blade\I fell\O apart\O .\O	I\O was\O sorely\O disapointed\O to\O discover\O that\O HP\O (\O what\O I\O thought\O was\O a\O reputable\O company\O )\O would\O n't\O honor\O the\O warrenty\O when\O the\O fan\O blade\O fell\B apart\I .\O
1434	More times that not the screen pops up saying I have a bad internet connection , or the page ca n't be displayed .	More\O times\O that\O not\O the\O screen\O pops\O up\O saying\O I\O have\O a\O bad\O internet\B connection\I ,\O or\O the\O page\O ca\O n't\O be\O displayed\O .\O	More\O times\O that\O not\O the\O screen\O pops\O up\O saying\O I\O have\O a\O bad\B internet\O connection\O ,\O or\O the\O page\O ca\O n't\O be\O displayed\O .\O
18	While most people say that PCs hold functionality and value and Macs are just pretty to look at , I think there 's something to be said about the simplicity of Macs .	While\O most\O people\O say\O that\O PCs\O hold\O functionality\O and\O value\O and\O Macs\O are\O just\O pretty\O to\O look\B at\O ,\O I\O think\O there\O 's\O something\O to\O be\O said\O about\O the\O simplicity\O of\O Macs\O .\O	While\O most\O people\O say\O that\O PCs\O hold\O functionality\O and\O value\O and\O Macs\O are\O just\O pretty\B to\O look\O at\O ,\O I\O think\O there\O 's\O something\O to\O be\O said\O about\O the\O simplicity\O of\O Macs\O .\O
1610	My macbook is so much better looking and so thin !	My\O macbook\O is\O so\O much\O better\O looking\B and\O so\O thin\O !\O	My\O macbook\O is\O so\O much\O better\B looking\O and\O so\O thin\O !\O
2292	The ease of use is wonderful .	The\O ease\O of\O use\B is\O wonderful\O .\O	The\O ease\B of\O use\O is\O wonderful\B .\O
171	The battery gets so HOT it is scary .	The\O battery\B gets\O so\O HOT\O it\O is\O scary\O .\O	The\O battery\O gets\O so\O HOT\B it\O is\O scary\B .\O
2753	Best thing is I can use existing 32 bit old programs .	Best\O thing\O is\O I\O can\O use\O existing\O 32\O bit\O old\O programs\B .\O	Best\B thing\O is\O I\O can\O use\O existing\O 32\O bit\O old\O programs\O .\O
3	It 's so nice to look at and the keys are easy to type with .	It\O 's\O so\O nice\O to\O look\O at\O and\O the\O keys\B are\O easy\O to\O type\O with\O .\O	It\O 's\O so\O nice\O to\O look\O at\O and\O the\O keys\O are\O easy\B to\O type\O with\O .\O
3	It 's so nice to look at and the keys are easy to type with .	It\O 's\O so\O nice\O to\O look\B at\O and\O the\O keys\O are\O easy\O to\O type\O with\O .\O	It\O 's\O so\O nice\B to\O look\O at\O and\O the\O keys\O are\O easy\O to\O type\O with\O .\O
2814	The only thing I would change about it is the mouse keys .	The\O only\O thing\O I\O would\O change\O about\O it\O is\O the\O mouse\B keys\I .\O	The\O only\O thing\O I\O would\O change\B about\O it\O is\O the\O mouse\O keys\O .\O
43	It is absolutely horrible to use , despite all its so called advanced features .	It\O is\O absolutely\O horrible\O to\O use\O ,\O despite\O all\O its\O so\O called\O advanced\O features\B .\O	It\O is\O absolutely\O horrible\O to\O use\O ,\O despite\O all\O its\O so\O called\O advanced\B features\O .\O
43	It is absolutely horrible to use , despite all its so called advanced features .	It\O is\O absolutely\O horrible\O to\O use\B ,\O despite\O all\O its\O so\O called\O advanced\O features\O .\O	It\O is\O absolutely\O horrible\B to\O use\O ,\O despite\O all\O its\O so\O called\O advanced\O features\O .\O
2996	I have to keep turning it until it decides to lower and there is no mute .	I\O have\O to\O keep\O turning\O it\O until\O it\O decides\O to\O lower\O and\O there\O is\O no\O mute\B .\O	I\O have\O to\O keep\O turning\O it\O until\O it\O decides\O to\O lower\O and\O there\O is\O no\B mute\O .\O
3022	It 's still beautiful and has better color reproduction than I could ever expect from a notebook .	It\O 's\O still\O beautiful\O and\O has\O better\O color\B reproduction\I than\O I\O could\O ever\O expect\O from\O a\O notebook\O .\O	It\O 's\O still\O beautiful\O and\O has\O better\B color\O reproduction\O than\O I\O could\O ever\O expect\O from\O a\O notebook\O .\O
1850	After that I turned to email in my next vain help to get them to acknowledge that the warranty was still valid .	After\O that\O I\O turned\O to\O email\O in\O my\O next\O vain\O help\O to\O get\O them\O to\O acknowledge\O that\O the\O warranty\B was\O still\O valid\O .\O	After\O that\O I\O turned\O to\O email\O in\O my\O next\O vain\O help\O to\O get\O them\O to\O acknowledge\O that\O the\O warranty\O was\O still\O valid\B .\O
2368	He loves it and it is easy to use and well the schools start teaching the kids early about computers so it was easy for him to get started .	He\O loves\O it\O and\O it\O is\O easy\O to\O use\B and\O well\O the\O schools\O start\O teaching\O the\O kids\O early\O about\O computers\O so\O it\O was\O easy\O for\O him\O to\O get\O started\O .\O	He\O loves\O it\O and\O it\O is\O easy\B to\O use\O and\O well\O the\O schools\O start\O teaching\O the\O kids\O early\O about\O computers\O so\O it\O was\O easy\O for\O him\O to\O get\O started\O .\O
1613	Also , macbooks come with much more features which are so cool !	Also\O ,\O macbooks\O come\O with\O much\O more\O features\B which\O are\O so\O cool\O !\O	Also\O ,\O macbooks\O come\O with\O much\O more\B features\O which\O are\O so\O cool\B !\O
2353	They have developed excellent proprietary software for editing video and pictures and I 'm looking forward to utilizing these tools on the regular .	They\O have\O developed\O excellent\O proprietary\B software\I for\O editing\O video\O and\O pictures\O and\O I\O 'm\O looking\O forward\O to\O utilizing\O these\O tools\O on\O the\O regular\O .\O	They\O have\O developed\O excellent\B proprietary\O software\O for\O editing\O video\O and\O pictures\O and\O I\O 'm\O looking\O forward\O to\O utilizing\O these\O tools\O on\O the\O regular\O .\O
2563	Getting the Apple Care plan is a must .	Getting\O the\O Apple\B Care\I plan\I is\O a\O must\O .\O	Getting\O the\O Apple\O Care\O plan\O is\O a\O must\B .\O
2306	overall i would recomend this to anybody and tell them that if they want to burn their music or play there video games to buy the cd drive .	overall\O i\O would\O recomend\O this\O to\O anybody\O and\O tell\O them\O that\O if\O they\O want\O to\O burn\O their\O music\O or\O play\O there\O video\O games\O to\O buy\O the\O cd\B drive\I .\O	overall\O i\O would\O recomend\B this\O to\O anybody\O and\O tell\O them\O that\O if\O they\O want\O to\O burn\O their\O music\O or\O play\O there\O video\O games\O to\O buy\O the\O cd\O drive\O .\O
102	The dv4 boasted a faster processor , more memory , and a bigger hard drive than my old computer , plus a better quality web cam , nicer screen , and many other features .	The\O dv4\O boasted\O a\O faster\O processor\B ,\O more\O memory\O ,\O and\O a\O bigger\O hard\O drive\O than\O my\O old\O computer\O ,\O plus\O a\O better\O quality\O web\O cam\O ,\O nicer\O screen\O ,\O and\O many\O other\O features\O .\O	The\O dv4\O boasted\O a\O faster\B processor\O ,\O more\O memory\O ,\O and\O a\O bigger\O hard\O drive\O than\O my\O old\O computer\O ,\O plus\O a\O better\O quality\O web\O cam\O ,\O nicer\O screen\O ,\O and\O many\O other\O features\O .\O
102	The dv4 boasted a faster processor , more memory , and a bigger hard drive than my old computer , plus a better quality web cam , nicer screen , and many other features .	The\O dv4\O boasted\O a\O faster\O processor\O ,\O more\O memory\B ,\O and\O a\O bigger\O hard\O drive\O than\O my\O old\O computer\O ,\O plus\O a\O better\O quality\O web\O cam\O ,\O nicer\O screen\O ,\O and\O many\O other\O features\O .\O	The\O dv4\O boasted\O a\O faster\O processor\O ,\O more\B memory\O ,\O and\O a\O bigger\O hard\O drive\O than\O my\O old\O computer\O ,\O plus\O a\O better\O quality\O web\O cam\O ,\O nicer\O screen\O ,\O and\O many\O other\O features\O .\O
102	The dv4 boasted a faster processor , more memory , and a bigger hard drive than my old computer , plus a better quality web cam , nicer screen , and many other features .	The\O dv4\O boasted\O a\O faster\O processor\O ,\O more\O memory\O ,\O and\O a\O bigger\O hard\B drive\I than\O my\O old\O computer\O ,\O plus\O a\O better\O quality\O web\O cam\O ,\O nicer\O screen\O ,\O and\O many\O other\O features\O .\O	The\O dv4\O boasted\O a\O faster\O processor\O ,\O more\O memory\O ,\O and\O a\O bigger\B hard\O drive\O than\O my\O old\O computer\O ,\O plus\O a\O better\O quality\O web\O cam\O ,\O nicer\O screen\O ,\O and\O many\O other\O features\O .\O
102	The dv4 boasted a faster processor , more memory , and a bigger hard drive than my old computer , plus a better quality web cam , nicer screen , and many other features .	The\O dv4\O boasted\O a\O faster\O processor\O ,\O more\O memory\O ,\O and\O a\O bigger\O hard\O drive\O than\O my\O old\O computer\O ,\O plus\O a\O better\O quality\O web\B cam\I ,\O nicer\O screen\O ,\O and\O many\O other\O features\O .\O	The\O dv4\O boasted\O a\O faster\O processor\O ,\O more\O memory\O ,\O and\O a\O bigger\O hard\O drive\O than\O my\O old\O computer\O ,\O plus\O a\O better\B quality\O web\O cam\O ,\O nicer\O screen\O ,\O and\O many\O other\O features\O .\O
102	The dv4 boasted a faster processor , more memory , and a bigger hard drive than my old computer , plus a better quality web cam , nicer screen , and many other features .	The\O dv4\O boasted\O a\O faster\O processor\O ,\O more\O memory\O ,\O and\O a\O bigger\O hard\O drive\O than\O my\O old\O computer\O ,\O plus\O a\O better\O quality\O web\O cam\O ,\O nicer\O screen\B ,\O and\O many\O other\O features\O .\O	The\O dv4\O boasted\O a\O faster\O processor\O ,\O more\O memory\O ,\O and\O a\O bigger\O hard\O drive\O than\O my\O old\O computer\O ,\O plus\O a\O better\O quality\O web\O cam\O ,\O nicer\B screen\O ,\O and\O many\O other\O features\O .\O
102	The dv4 boasted a faster processor , more memory , and a bigger hard drive than my old computer , plus a better quality web cam , nicer screen , and many other features .	The\O dv4\O boasted\O a\O faster\O processor\O ,\O more\O memory\O ,\O and\O a\O bigger\O hard\O drive\O than\O my\O old\O computer\O ,\O plus\O a\O better\O quality\O web\O cam\O ,\O nicer\O screen\O ,\O and\O many\O other\O features\B .\O	The\O dv4\O boasted\O a\O faster\O processor\O ,\O more\O memory\O ,\O and\O a\O bigger\O hard\O drive\O than\O my\O old\O computer\O ,\O plus\O a\O better\O quality\O web\O cam\O ,\O nicer\O screen\O ,\O and\O many\B other\O features\O .\O
2966	The only downfall is the battery only last 1.5-2.0 hrs when not plugged in .	The\O only\O downfall\O is\O the\O battery\B only\O last\O 1.5-2.0\O hrs\O when\O not\O plugged\O in\O .\O	The\O only\O downfall\B is\O the\O battery\O only\O last\O 1.5-2.0\O hrs\O when\O not\O plugged\O in\O .\O
2211	The graphics on this computer are also stellar - very clear and vivid .	The\O graphics\B on\O this\O computer\O are\O also\O stellar\O -\O very\O clear\O and\O vivid\O .\O	The\O graphics\O on\O this\O computer\O are\O also\O stellar\B -\O very\O clear\B and\O vivid\B .\O
2819	Aside from the trial software and the short battery life , lack of a webcam , its great .	Aside\O from\O the\O trial\O software\O and\O the\O short\O battery\B life\I ,\O lack\O of\O a\O webcam\O ,\O its\O great\O .\O	Aside\O from\O the\O trial\O software\O and\O the\O short\B battery\O life\O ,\O lack\O of\O a\O webcam\O ,\O its\O great\O .\O
2819	Aside from the trial software and the short battery life , lack of a webcam , its great .	Aside\O from\O the\O trial\O software\O and\O the\O short\O battery\O life\O ,\O lack\O of\O a\O webcam\B ,\O its\O great\O .\O	Aside\O from\O the\O trial\O software\O and\O the\O short\O battery\O life\O ,\O lack\B of\O a\O webcam\O ,\O its\O great\O .\O
2723	Graphics are clean and sharp , internet interfaces are seamless .	Graphics\B are\O clean\O and\O sharp\O ,\O internet\O interfaces\O are\O seamless\O .\O	Graphics\O are\O clean\B and\O sharp\B ,\O internet\O interfaces\O are\O seamless\O .\O
2723	Graphics are clean and sharp , internet interfaces are seamless .	Graphics\O are\O clean\O and\O sharp\O ,\O internet\B interfaces\I are\O seamless\O .\O	Graphics\O are\O clean\O and\O sharp\O ,\O internet\O interfaces\O are\O seamless\B .\O
73	The newer black keyboard took a little bit away from the previous gray one which looked really slick , but it is still a great notebook !	The\O newer\O black\B keyboard\I took\O a\O little\O bit\O away\O from\O the\O previous\O gray\O one\O which\O looked\O really\O slick\O ,\O but\O it\O is\O still\O a\O great\O notebook\O !\O	The\O newer\B black\O keyboard\O took\O a\O little\O bit\O away\O from\O the\O previous\O gray\O one\O which\O looked\O really\O slick\O ,\O but\O it\O is\O still\O a\O great\B notebook\O !\O
1082	Sony parts reliability and quality of service is recenlty the worst .	Sony\O parts\O reliability\O and\O quality\O of\O service\B is\O recenlty\O the\O worst\O .\O	Sony\O parts\O reliability\O and\O quality\O of\O service\O is\O recenlty\O the\O worst\B .\O
2677	As with any laptop not purchased with software options , it comes with a lot of what I consider useless applications .	As\O with\O any\O laptop\O not\O purchased\O with\O software\O options\O ,\O it\O comes\O with\O a\O lot\O of\O what\O I\O consider\O useless\O applications\B .\O	As\O with\O any\O laptop\O not\O purchased\O with\O software\O options\O ,\O it\O comes\O with\O a\O lot\O of\O what\O I\O consider\O useless\B applications\O .\O
