s_id	sentence	target_tags	opinion_words_tags
1606837:1	With the theater 2 blocks away we had a delicious meal in a beautiful room .	With\O the\O theater\O 2\O blocks\O away\O we\O had\O a\O delicious\O meal\B in\O a\O beautiful\O room\O .\O	With\O the\O theater\O 2\O blocks\O away\O we\O had\O a\O delicious\B meal\O in\O a\O beautiful\O room\O .\O
1606837:1	With the theater 2 blocks away we had a delicious meal in a beautiful room .	With\O the\O theater\O 2\O blocks\O away\O we\O had\O a\O delicious\O meal\O in\O a\O beautiful\O room\B .\O	With\O the\O theater\O 2\O blocks\O away\O we\O had\O a\O delicious\O meal\O in\O a\O beautiful\B room\O .\O
1606837:2	The service was attentive .	The\O service\B was\O attentive\O .\O	The\O service\O was\O attentive\B .\O
1609375:0	Planet Thai is great !	Planet\B Thai\I is\O great\O !\O	Planet\O Thai\O is\O great\B !\O
1609375:1	We love the food , drinks , and atmosphere !	We\O love\O the\O food\B ,\O drinks\O ,\O and\O atmosphere\O !\O	We\O love\B the\O food\O ,\O drinks\O ,\O and\O atmosphere\O !\O
1609375:1	We love the food , drinks , and atmosphere !	We\O love\O the\O food\O ,\O drinks\B ,\O and\O atmosphere\O !\O	We\O love\B the\O food\O ,\O drinks\O ,\O and\O atmosphere\O !\O
1609375:1	We love the food , drinks , and atmosphere !	We\O love\O the\O food\O ,\O drinks\O ,\O and\O atmosphere\B !\O	We\O love\B the\O food\O ,\O drinks\O ,\O and\O atmosphere\O !\O
1609375:2	The svc can be a bit rude at times , esp if you have big group , but overall the restaurant is a must !	The\O svc\B can\O be\O a\O bit\O rude\O at\O times\O ,\O esp\O if\O you\O have\O big\O group\O ,\O but\O overall\O the\O restaurant\O is\O a\O must\O !\O	The\O svc\O can\O be\O a\O bit\O rude\B at\O times\O ,\O esp\O if\O you\O have\O big\O group\O ,\O but\O overall\O the\O restaurant\O is\O a\O must\O !\O
1609375:2	The svc can be a bit rude at times , esp if you have big group , but overall the restaurant is a must !	The\O svc\O can\O be\O a\O bit\O rude\O at\O times\O ,\O esp\O if\O you\O have\O big\O group\O ,\O but\O overall\O the\O restaurant\B is\O a\O must\O !\O	The\O svc\O can\O be\O a\O bit\O rude\O at\O times\O ,\O esp\O if\O you\O have\O big\O group\O ,\O but\O overall\O the\O restaurant\O is\O a\O must\B !\O
1609375:3	Try the Pad Thai , it 's fabulous and their prices are so cheap !	Try\O the\O Pad\B Thai\I ,\O it\O 's\O fabulous\O and\O their\O prices\O are\O so\O cheap\O !\O	Try\B the\O Pad\O Thai\O ,\O it\O 's\O fabulous\B and\O their\O prices\O are\O so\O cheap\B !\O
1609375:4	Just because it 's cheap does NOT mean the portions are small or the food is nasty , IT IS GREAT !	Just\O because\O it\O 's\O cheap\O does\O NOT\O mean\O the\O portions\B are\O small\O or\O the\O food\O is\O nasty\O ,\O IT\O IS\O GREAT\O !\O	Just\O because\O it\O 's\O cheap\O does\O NOT\O mean\O the\O portions\O are\O small\B or\O the\O food\O is\O nasty\O ,\O IT\O IS\O GREAT\O !\O
1609375:4	Just because it 's cheap does NOT mean the portions are small or the food is nasty , IT IS GREAT !	Just\O because\O it\O 's\O cheap\O does\O NOT\O mean\O the\O portions\O are\O small\O or\O the\O food\B is\O nasty\O ,\O IT\O IS\O GREAT\O !\O	Just\O because\O it\O 's\O cheap\O does\O NOT\O mean\O the\O portions\O are\O small\O or\O the\O food\O is\O nasty\B ,\O IT\O IS\O GREAT\O !\O
1611489:3	Eating in , the atmosphere saves it , but at your desk , it 's a very disappointing experience .	Eating\O in\O ,\O the\O atmosphere\B saves\O it\O ,\O but\O at\O your\O desk\O ,\O it\O 's\O a\O very\O disappointing\O experience\O .\O	Eating\O in\O ,\O the\O atmosphere\O saves\B it\O ,\O but\O at\O your\O desk\O ,\O it\O 's\O a\O very\O disappointing\O experience\O .\O
1615322:1	Chennai Garden is my favorite Indian restaurant in the city .	Chennai\B Garden\I is\O my\O favorite\O Indian\O restaurant\O in\O the\O city\O .\O	Chennai\O Garden\O is\O my\O favorite\B Indian\O restaurant\O in\O the\O city\O .\O
1615322:2	They have authentic Indian at amazin prices .	They\O have\O authentic\O Indian\B at\O amazin\O prices\O .\O	They\O have\O authentic\B Indian\O at\O amazin\O prices\O .\O
1615322:4	The seats are uncomfortable if you are sitting against the wall on wooden benches .	The\O seats\B are\O uncomfortable\O if\O you\O are\O sitting\O against\O the\O wall\O on\O wooden\O benches\O .\O	The\O seats\O are\O uncomfortable\B if\O you\O are\O sitting\O against\O the\O wall\O on\O wooden\O benches\O .\O
1615322:5	It 's a rather cramped and busy restaurant and it closes early .	It\O 's\O a\O rather\O cramped\O and\O busy\O restaurant\B and\O it\O closes\O early\O .\O	It\O 's\O a\O rather\O cramped\B and\O busy\B restaurant\O and\O it\O closes\O early\O .\O
1623276:0	Patroon features a nice cigar bar and has great staff .	Patroon\O features\O a\O nice\O cigar\B bar\I and\O has\O great\O staff\O .\O	Patroon\O features\O a\O nice\B cigar\O bar\O and\O has\O great\O staff\O .\O
1623276:0	Patroon features a nice cigar bar and has great staff .	Patroon\O features\O a\O nice\O cigar\O bar\O and\O has\O great\O staff\B .\O	Patroon\O features\O a\O nice\O cigar\O bar\O and\O has\O great\B staff\O .\O
1623276:1	The food is tasty and portion sizes are appropriate .	The\O food\B is\O tasty\O and\O portion\O sizes\O are\O appropriate\O .\O	The\O food\O is\O tasty\B and\O portion\O sizes\O are\O appropriate\O .\O
1623276:1	The food is tasty and portion sizes are appropriate .	The\O food\O is\O tasty\O and\O portion\B sizes\I are\O appropriate\O .\O	The\O food\O is\O tasty\O and\O portion\O sizes\O are\O appropriate\B .\O
1623276:2	This is a nice restaurant if you are looking for a good place to host an intimate dinner meeting with business associates .	This\O is\O a\O nice\O restaurant\B if\O you\O are\O looking\O for\O a\O good\O place\O to\O host\O an\O intimate\O dinner\O meeting\O with\O business\O associates\O .\O	This\O is\O a\O nice\B restaurant\O if\O you\O are\O looking\O for\O a\O good\O place\O to\O host\O an\O intimate\O dinner\O meeting\O with\O business\O associates\O .\O
1623276:3	Not a great place for family or general dining .	Not\O a\O great\O place\B for\O family\O or\O general\O dining\O .\O	Not\B a\I great\I place\O for\O family\O or\O general\O dining\O .\O
1626564:0	LOVE THIS PLACE .	LOVE\O THIS\O PLACE\B .\O	LOVE\B THIS\O PLACE\O .\O
1626564:1	Food is excellent .	Food\B is\O excellent\O .\O	Food\O is\O excellent\B .\O
1626564:2	Fish is so very fresh .	Fish\B is\O so\O very\O fresh\O .\O	Fish\O is\O so\O very\O fresh\B .\O
1626564:3	Waitstaff are very friendly .	Waitstaff\B are\O very\O friendly\O .\O	Waitstaff\O are\O very\O friendly\B .\O
1626564:4	Love YUKA .	Love\O YUKA\B .\O	Love\B YUKA\O .\O
1632445:0	Mermaid Inn is an overall good restaurant with really good seafood .	Mermaid\O Inn\O is\O an\O overall\O good\O restaurant\O with\O really\O good\O seafood\B .\O	Mermaid\O Inn\O is\O an\O overall\O good\O restaurant\O with\O really\O good\B seafood\O .\O
1632445:0	Mermaid Inn is an overall good restaurant with really good seafood .	Mermaid\B Inn\I is\O an\O overall\O good\O restaurant\O with\O really\O good\O seafood\O .\O	Mermaid\O Inn\O is\O an\O overall\O good\B restaurant\O with\O really\O good\O seafood\O .\O
1632445:1	The menu is limited but almost all of the dishes are excellent .	The\O menu\B is\O limited\O but\O almost\O all\O of\O the\O dishes\O are\O excellent\O .\O	The\O menu\O is\O limited\B but\O almost\O all\O of\O the\O dishes\O are\O excellent\O .\O
1632445:1	The menu is limited but almost all of the dishes are excellent .	The\O menu\O is\O limited\O but\O almost\O all\O of\O the\O dishes\B are\O excellent\O .\O	The\O menu\O is\O limited\O but\O almost\O all\O of\O the\O dishes\O are\O excellent\B .\O
1632445:2	The lobster sandwich is good and the spaghetti with Scallops and Shrimp is great .	The\O lobster\B sandwich\I is\O good\O and\O the\O spaghetti\O with\O Scallops\O and\O Shrimp\O is\O great\O .\O	The\O lobster\O sandwich\O is\O good\B and\O the\O spaghetti\O with\O Scallops\O and\O Shrimp\O is\O great\O .\O
1632445:2	The lobster sandwich is good and the spaghetti with Scallops and Shrimp is great .	The\O lobster\O sandwich\O is\O good\O and\O the\O spaghetti\B with\I Scallops\I and\I Shrimp\I is\O great\O .\O	The\O lobster\O sandwich\O is\O good\O and\O the\O spaghetti\O with\O Scallops\O and\O Shrimp\O is\O great\B .\O
1632445:3	The service is good and ambience is good for a date or group outing .	The\O service\B is\O good\O and\O ambience\O is\O good\O for\O a\O date\O or\O group\O outing\O .\O	The\O service\O is\O good\B and\O ambience\O is\O good\O for\O a\O date\O or\O group\O outing\O .\O
1632445:3	The service is good and ambience is good for a date or group outing .	The\O service\O is\O good\O and\O ambience\B is\O good\O for\O a\O date\O or\O group\O outing\O .\O	The\O service\O is\O good\O and\O ambience\O is\O good\B for\O a\O date\O or\O group\O outing\O .\O
1632445:4	The only fallback on this restaurant is the prices .	The\O only\O fallback\O on\O this\O restaurant\B is\O the\O prices\O .\O	The\O only\O fallback\B on\O this\O restaurant\O is\O the\O prices\O .\O
1632445:5	Even though its good seafood , the prices are too high .	Even\O though\O its\O good\O seafood\B ,\O the\O prices\O are\O too\O high\O .\O	Even\O though\O its\O good\B seafood\O ,\O the\O prices\O are\O too\O high\O .\O
1632445:6	The lobster sandwich is $ 24 and although it was good it was not nearly enough to warrant that price .	The\O lobster\B sandwich\I is\O $\O 24\O and\O although\O it\O was\O good\O it\O was\O not\O nearly\O enough\O to\O warrant\O that\O price\O .\O	The\O lobster\O sandwich\O is\O $\O 24\O and\O although\O it\O was\O good\B it\O was\O not\B nearly\I enough\I to\I warrant\I that\I price\I .\O
1632929:3	The food was delicious ( I had a halibut special , my husband had steak ) , and the service was top-notch .	The\O food\B was\O delicious\O (\O I\O had\O a\O halibut\O special\O ,\O my\O husband\O had\O steak\O )\O ,\O and\O the\O service\O was\O top-notch\O .\O	The\O food\O was\O delicious\B (\O I\O had\O a\O halibut\O special\O ,\O my\O husband\O had\O steak\O )\O ,\O and\O the\O service\O was\O top-notch\O .\O
1632929:3	The food was delicious ( I had a halibut special , my husband had steak ) , and the service was top-notch .	The\O food\O was\O delicious\O (\O I\O had\O a\O halibut\O special\O ,\O my\O husband\O had\O steak\O )\O ,\O and\O the\O service\B was\O top-notch\O .\O	The\O food\O was\O delicious\O (\O I\O had\O a\O halibut\O special\O ,\O my\O husband\O had\O steak\O )\O ,\O and\O the\O service\O was\O top-notch\B .\O
1632929:5	Truly the mark of an attentive waiter .	Truly\O the\O mark\O of\O an\O attentive\O waiter\B .\O	Truly\O the\O mark\O of\O an\O attentive\B waiter\O .\O
1632929:6	I highly recommend the restaurant based on our experience last night .	I\O highly\O recommend\O the\O restaurant\B based\O on\O our\O experience\O last\O night\O .\O	I\O highly\O recommend\B the\O restaurant\O based\O on\O our\O experience\O last\O night\O .\O
1642666:0	We ate at this Thai place following the reviews but very unhappy with the foods .	We\O ate\O at\O this\O Thai\O place\O following\O the\O reviews\O but\O very\O unhappy\O with\O the\O foods\B .\O	We\O ate\O at\O this\O Thai\O place\O following\O the\O reviews\O but\O very\O unhappy\B with\O the\O foods\O .\O
1649025:1	I recommend the jelly fish , drunken chicken and the soupy dumplings , certainly the stir fry blue crab .	I\O recommend\O the\O jelly\B fish\I ,\O drunken\O chicken\O and\O the\O soupy\O dumplings\O ,\O certainly\O the\O stir\O fry\O blue\O crab\O .\O	I\O recommend\B the\O jelly\O fish\O ,\O drunken\O chicken\O and\O the\O soupy\O dumplings\O ,\O certainly\O the\O stir\O fry\O blue\O crab\O .\O
1649025:1	I recommend the jelly fish , drunken chicken and the soupy dumplings , certainly the stir fry blue crab .	I\O recommend\O the\O jelly\O fish\O ,\O drunken\B chicken\I and\O the\O soupy\O dumplings\O ,\O certainly\O the\O stir\O fry\O blue\O crab\O .\O	I\O recommend\B the\O jelly\O fish\O ,\O drunken\O chicken\O and\O the\O soupy\O dumplings\O ,\O certainly\O the\O stir\O fry\O blue\O crab\O .\O
1649025:1	I recommend the jelly fish , drunken chicken and the soupy dumplings , certainly the stir fry blue crab .	I\O recommend\O the\O jelly\O fish\O ,\O drunken\O chicken\O and\O the\O soupy\B dumplings\I ,\O certainly\O the\O stir\O fry\O blue\O crab\O .\O	I\O recommend\B the\O jelly\O fish\O ,\O drunken\O chicken\O and\O the\O soupy\O dumplings\O ,\O certainly\O the\O stir\O fry\O blue\O crab\O .\O
1649025:1	I recommend the jelly fish , drunken chicken and the soupy dumplings , certainly the stir fry blue crab .	I\O recommend\O the\O jelly\O fish\O ,\O drunken\O chicken\O and\O the\O soupy\O dumplings\O ,\O certainly\O the\O stir\B fry\I blue\I crab\I .\O	I\O recommend\B the\O jelly\O fish\O ,\O drunken\O chicken\O and\O the\O soupy\O dumplings\O ,\O certainly\O the\O stir\O fry\O blue\O crab\O .\O
1649025:2	The food is so cheap and the waiters are nice .	The\O food\B is\O so\O cheap\O and\O the\O waiters\O are\O nice\O .\O	The\O food\O is\O so\O cheap\B and\O the\O waiters\O are\O nice\O .\O
1649025:2	The food is so cheap and the waiters are nice .	The\O food\O is\O so\O cheap\O and\O the\O waiters\B are\O nice\O .\O	The\O food\O is\O so\O cheap\O and\O the\O waiters\O are\O nice\B .\O
1655504:0	Have frequented 'ino for several years and the food remains excellent .	Have\O frequented\O 'ino\O for\O several\O years\O and\O the\O food\B remains\O excellent\O .\O	Have\O frequented\O 'ino\O for\O several\O years\O and\O the\O food\O remains\O excellent\B .\O
1655504:1	Cheese plate is a varied delight and great bargain at $ 10 .	Cheese\B plate\I is\O a\O varied\O delight\O and\O great\O bargain\O at\O $\O 10\O .\O	Cheese\O plate\O is\O a\O varied\B delight\I and\O great\B bargain\I at\O $\O 10\O .\O
1655504:3	( The asparagus , truffle oil , parmesan bruschetta is a winner ! )	(\O The\O asparagus\B ,\I truffle\I oil\I ,\I parmesan\I bruschetta\I is\O a\O winner\O !\O )\O	(\O The\O asparagus\O ,\O truffle\O oil\O ,\O parmesan\O bruschetta\O is\O a\O winner\B !\O )\O
1655504:4	Wine list is extensive without being over-priced .	Wine\B list\I is\O extensive\O without\O being\O over-priced\O .\O	Wine\O list\O is\O extensive\B without\B being\I over-priced\I .\O
1655504:5	Be sure to try the seasonal , and always delicious , specials .	Be\O sure\O to\O try\O the\O seasonal\O ,\O and\O always\O delicious\O ,\O specials\B .\O	Be\O sure\O to\O try\B the\O seasonal\B ,\O and\O always\O delicious\B ,\O specials\O .\O
1655521:0	I loved this place ! !	I\O loved\O this\O place\B !\O !\O	I\O loved\B this\O place\O !\O !\O
1655521:1	I almost hesititate to write a review because the atmosphere was so great and I would hate for it too become to crowded .	I\O almost\O hesititate\O to\O write\O a\O review\O because\O the\O atmosphere\B was\O so\O great\O and\O I\O would\O hate\O for\O it\O too\O become\O to\O crowded\O .\O	I\O almost\O hesititate\O to\O write\O a\O review\O because\O the\O atmosphere\O was\O so\O great\B and\O I\O would\O hate\O for\O it\O too\O become\O to\O crowded\O .\O
1655521:2	The food was very good , a great deal , and the place its self was great .	The\O food\B was\O very\O good\O ,\O a\O great\O deal\O ,\O and\O the\O place\O its\O self\O was\O great\O .\O	The\O food\O was\O very\O good\B ,\O a\O great\O deal\O ,\O and\O the\O place\O its\O self\O was\O great\O .\O
1655521:2	The food was very good , a great deal , and the place its self was great .	The\O food\O was\O very\O good\O ,\O a\O great\O deal\O ,\O and\O the\O place\B its\O self\O was\O great\O .\O	The\O food\O was\O very\O good\O ,\O a\O great\O deal\O ,\O and\O the\O place\O its\O self\O was\O great\B .\O
1655521:3	The wait staff is very freindly , they make it feel like you 're eating in a freindly little european town .	The\O wait\B staff\I is\O very\O freindly\O ,\O they\O make\O it\O feel\O like\O you\O 're\O eating\O in\O a\O freindly\O little\O european\O town\O .\O	The\O wait\O staff\O is\O very\O freindly\B ,\O they\O make\O it\O feel\O like\O you\O 're\O eating\O in\O a\O freindly\O little\O european\O town\O .\O
1660047:0	I like Cafe Noir dont get me wrong , it is jsut that the people who work there are evil and incompetent ! !	I\O like\O Cafe\O Noir\O dont\O get\O me\O wrong\O ,\O it\O is\O jsut\O that\O the\O people\B who\O work\O there\O are\O evil\O and\O incompetent\O !\O !\O	I\O like\O Cafe\O Noir\O dont\O get\O me\O wrong\O ,\O it\O is\O jsut\O that\O the\O people\O who\O work\O there\O are\O evil\B and\O incompetent\B !\O !\O
1660047:0	I like Cafe Noir dont get me wrong , it is jsut that the people who work there are evil and incompetent ! !	I\O like\O Cafe\B Noir\I dont\O get\O me\O wrong\O ,\O it\O is\O jsut\O that\O the\O people\O who\O work\O there\O are\O evil\O and\O incompetent\O !\O !\O	I\O like\B Cafe\O Noir\O dont\O get\O me\O wrong\O ,\O it\O is\O jsut\O that\O the\O people\O who\O work\O there\O are\O evil\O and\O incompetent\O !\O !\O
1660047:1	The service was terrible , we had to wait for everything and ask several of different people for the same thing before we were allowed to be served .	The\O service\B was\O terrible\O ,\O we\O had\O to\O wait\O for\O everything\O and\O ask\O several\O of\O different\O people\O for\O the\O same\O thing\O before\O we\O were\O allowed\O to\O be\O served\O .\O	The\O service\O was\O terrible\B ,\O we\O had\O to\O wait\O for\O everything\O and\O ask\O several\O of\O different\O people\O for\O the\O same\O thing\O before\O we\O were\O allowed\O to\O be\O served\O .\O
1660047:5	The whole set up is truly unprofessional and I wish Cafe Noir would get some good staff , because despite the current one this is a great place .	The\O whole\O set\O up\O is\O truly\O unprofessional\O and\O I\O wish\O Cafe\O Noir\O would\O get\O some\O good\O staff\B ,\O because\O despite\O the\O current\O one\O this\O is\O a\O great\O place\O .\O	The\O whole\O set\O up\O is\O truly\O unprofessional\O and\O I\O wish\O Cafe\O Noir\O would\O get\O some\O good\B staff\O ,\O because\O despite\O the\O current\O one\O this\O is\O a\O great\O place\O .\O
1660047:5	The whole set up is truly unprofessional and I wish Cafe Noir would get some good staff , because despite the current one this is a great place .	The\O whole\O set\O up\O is\O truly\O unprofessional\O and\O I\O wish\O Cafe\B Noir\I would\O get\O some\O good\O staff\O ,\O because\O despite\O the\O current\O one\O this\O is\O a\O great\O place\O .\O	The\O whole\O set\O up\O is\O truly\O unprofessional\O and\O I\O wish\O Cafe\O Noir\O would\O get\O some\O good\O staff\O ,\O because\O despite\O the\O current\O one\O this\O is\O a\O great\B place\O .\O
1661043:0	Pizza here is consistently good .	Pizza\B here\O is\O consistently\O good\O .\O	Pizza\O here\O is\O consistently\O good\B .\O
1661043:1	Salads are a delicious way to begin the meal .	Salads\B are\O a\O delicious\O way\O to\O begin\O the\O meal\O .\O	Salads\O are\O a\O delicious\B way\O to\O begin\O the\O meal\O .\O
1661043:2	You should pass on the calamari .	You\O should\O pass\O on\O the\O calamari\B .\O	You\O should\O pass\B on\O the\O calamari\O .\O
1661043:4	Decor is charming .	Decor\B is\O charming\O .\O	Decor\O is\O charming\B .\O
1661043:5	Service is average .	Service\B is\O average\O .\O	Service\O is\O average\B .\O
1661757:0	What a great place .	What\O a\O great\O place\B .\O	What\O a\O great\B place\O .\O
1661757:2	The ambience was so fun , and the prices were great , on top of the fact that the food was really tasty .	The\O ambience\B was\O so\O fun\O ,\O and\O the\O prices\O were\O great\O ,\O on\O top\O of\O the\O fact\O that\O the\O food\O was\O really\O tasty\O .\O	The\O ambience\O was\O so\O fun\B ,\O and\O the\O prices\O were\O great\O ,\O on\O top\O of\O the\O fact\O that\O the\O food\O was\O really\O tasty\O .\O
1661757:2	The ambience was so fun , and the prices were great , on top of the fact that the food was really tasty .	The\O ambience\O was\O so\O fun\O ,\O and\O the\O prices\O were\O great\O ,\O on\O top\O of\O the\O fact\O that\O the\O food\B was\O really\O tasty\O .\O	The\O ambience\O was\O so\O fun\O ,\O and\O the\O prices\O were\O great\O ,\O on\O top\O of\O the\O fact\O that\O the\O food\O was\O really\O tasty\B .\O
1661757:4	I would definitely recommend SEA if you like thai cuisine !	I\O would\O definitely\O recommend\O SEA\O if\O you\O like\O thai\B cuisine\I !\O	I\O would\O definitely\O recommend\O SEA\O if\O you\O like\B thai\O cuisine\O !\O
1662726:0	I was here a few weeks back and we had the worst customer service experience at a restaurant ever .	I\O was\O here\O a\O few\O weeks\O back\O and\O we\O had\O the\O worst\O customer\B service\I experience\O at\O a\O restaurant\O ever\O .\O	I\O was\O here\O a\O few\O weeks\O back\O and\O we\O had\O the\O worst\B customer\O service\O experience\O at\O a\O restaurant\O ever\O .\O
1663111:0	I absolutely Loved this place .	I\O absolutely\O Loved\O this\O place\B .\O	I\O absolutely\O Loved\B this\O place\O .\O
1663111:2	Excellent atmosphere , delicious dishes good and friendly service .	Excellent\O atmosphere\B ,\O delicious\O dishes\O good\O and\O friendly\O service\O .\O	Excellent\B atmosphere\O ,\O delicious\O dishes\O good\O and\O friendly\O service\O .\O
1663111:2	Excellent atmosphere , delicious dishes good and friendly service .	Excellent\O atmosphere\O ,\O delicious\O dishes\B good\O and\O friendly\O service\O .\O	Excellent\O atmosphere\O ,\O delicious\B dishes\O good\O and\O friendly\O service\O .\O
1663111:2	Excellent atmosphere , delicious dishes good and friendly service .	Excellent\O atmosphere\O ,\O delicious\O dishes\O good\O and\O friendly\O service\B .\O	Excellent\O atmosphere\O ,\O delicious\O dishes\O good\B and\O friendly\B service\O .\O
1663111:5	The wine list is also really nice .	The\O wine\B list\I is\O also\O really\O nice\O .\O	The\O wine\O list\O is\O also\O really\O nice\B .\O
1664346:1	Everything was wonderful ; food , drinks , staff , mileau .	Everything\O was\O wonderful\O ;\O food\B ,\O drinks\O ,\O staff\O ,\O mileau\O .\O	Everything\O was\O wonderful\B ;\O food\O ,\O drinks\O ,\O staff\O ,\O mileau\O .\O
1664346:1	Everything was wonderful ; food , drinks , staff , mileau .	Everything\O was\O wonderful\O ;\O food\O ,\O drinks\B ,\O staff\O ,\O mileau\O .\O	Everything\O was\O wonderful\B ;\O food\O ,\O drinks\O ,\O staff\O ,\O mileau\O .\O
1664346:1	Everything was wonderful ; food , drinks , staff , mileau .	Everything\O was\O wonderful\O ;\O food\O ,\O drinks\O ,\O staff\B ,\O mileau\O .\O	Everything\O was\O wonderful\B ;\O food\O ,\O drinks\O ,\O staff\O ,\O mileau\O .\O
1664346:1	Everything was wonderful ; food , drinks , staff , mileau .	Everything\O was\O wonderful\O ;\O food\O ,\O drinks\O ,\O staff\O ,\O mileau\B .\O	Everything\O was\O wonderful\B ;\O food\O ,\O drinks\O ,\O staff\O ,\O mileau\O .\O
1664346:2	I would highly recommend this place !	I\O would\O highly\O recommend\O this\O place\B !\O	I\O would\O highly\O recommend\B this\O place\O !\O
1671113:0	I have been to Casimir over 5 times and I have always had a great time there .	I\O have\O been\O to\O Casimir\B over\O 5\O times\O and\O I\O have\O always\O had\O a\O great\O time\O there\O .\O	I\O have\O been\O to\O Casimir\O over\O 5\O times\O and\O I\O have\O always\O had\O a\O great\B time\I there\O .\O
1671113:1	The food is great and reasonably priced .	The\O food\B is\O great\O and\O reasonably\O priced\O .\O	The\O food\O is\O great\B and\O reasonably\B priced\I .\O
1671113:4	The staff has been nice , but they seemed really stressed and the unisex bathroom needs to be cleaned more often .	The\O staff\B has\O been\O nice\O ,\O but\O they\O seemed\O really\O stressed\O and\O the\O unisex\O bathroom\O needs\O to\O be\O cleaned\O more\O often\O .\O	The\O staff\O has\O been\O nice\B ,\O but\O they\O seemed\O really\O stressed\B and\O the\O unisex\O bathroom\O needs\O to\O be\O cleaned\O more\O often\O .\O
1671113:4	The staff has been nice , but they seemed really stressed and the unisex bathroom needs to be cleaned more often .	The\O staff\O has\O been\O nice\O ,\O but\O they\O seemed\O really\O stressed\O and\O the\O unisex\B bathroom\I needs\O to\O be\O cleaned\O more\O often\O .\O	The\O staff\O has\O been\O nice\O ,\O but\O they\O seemed\O really\O stressed\B and\O the\O unisex\O bathroom\O needs\O to\O be\O cleaned\O more\O often\O .\O
1700205:1	From the spectacular caviar to the hospitable waitstaff , I felt like royalty and enjoyed every second of it .	From\O the\O spectacular\O caviar\B to\O the\O hospitable\O waitstaff\O ,\O I\O felt\O like\O royalty\O and\O enjoyed\O every\O second\O of\O it\O .\O	From\O the\O spectacular\B caviar\O to\O the\O hospitable\O waitstaff\O ,\O I\O felt\O like\O royalty\O and\O enjoyed\B every\O second\O of\O it\O .\O
1700205:1	From the spectacular caviar to the hospitable waitstaff , I felt like royalty and enjoyed every second of it .	From\O the\O spectacular\O caviar\O to\O the\O hospitable\O waitstaff\B ,\O I\O felt\O like\O royalty\O and\O enjoyed\O every\O second\O of\O it\O .\O	From\O the\O spectacular\O caviar\O to\O the\O hospitable\B waitstaff\O ,\O I\O felt\O like\O royalty\O and\O enjoyed\B every\O second\O of\O it\O .\O
