s_id	sentence	target_tags	opinion_words_tags
1297844:4	The workers there also absolutely load the bagel with cream cheese ( gets a little messy ) .	The\O workers\O there\O also\O absolutely\O load\O the\O bagel\B with\O cream\O cheese\O (\O gets\O a\O little\O messy\O )\O .\O	The\O workers\O there\O also\O absolutely\O load\O the\O bagel\O with\O cream\O cheese\O (\O gets\O a\O little\O messy\B )\O .\O
1300636:0	This was my frist time at Cafe St. Bart 's and I must say how delicious the food and the service was .	This\O was\O my\O frist\O time\O at\O Cafe\O St.\O Bart\O 's\O and\O I\O must\O say\O how\O delicious\O the\O food\B and\O the\O service\O was\O .\O	This\O was\O my\O frist\O time\O at\O Cafe\O St.\O Bart\O 's\O and\O I\O must\O say\O how\O delicious\B the\O food\O and\O the\O service\O was\O .\O
1300636:2	I have to highly recommend the lobster roll - not to much mayo ; you can tell it was a fresh lobster .	I\O have\O to\O highly\O recommend\O the\O lobster\B roll\I -\O not\O to\O much\O mayo\O ;\O you\O can\O tell\O it\O was\O a\O fresh\O lobster\O .\O	I\O have\O to\O highly\O recommend\B the\O lobster\O roll\O -\O not\O to\O much\O mayo\O ;\O you\O can\O tell\O it\O was\O a\O fresh\O lobster\O .\O
1300636:2	I have to highly recommend the lobster roll - not to much mayo ; you can tell it was a fresh lobster .	I\O have\O to\O highly\O recommend\O the\O lobster\O roll\O -\O not\O to\O much\O mayo\O ;\O you\O can\O tell\O it\O was\O a\O fresh\O lobster\B .\O	I\O have\O to\O highly\O recommend\O the\O lobster\O roll\O -\O not\O to\O much\O mayo\O ;\O you\O can\O tell\O it\O was\O a\O fresh\B lobster\O .\O
1300636:3	Other guests enjoyed pizza , santa fe chopped salad and fish and chips .	Other\O guests\O enjoyed\O pizza\B ,\O santa\O fe\O chopped\O salad\O and\O fish\O and\O chips\O .\O	Other\O guests\O enjoyed\B pizza\O ,\O santa\O fe\O chopped\O salad\O and\O fish\O and\O chips\O .\O
1300636:3	Other guests enjoyed pizza , santa fe chopped salad and fish and chips .	Other\O guests\O enjoyed\O pizza\O ,\O santa\B fe\I chopped\I salad\I and\O fish\O and\O chips\O .\O	Other\O guests\O enjoyed\B pizza\O ,\O santa\O fe\O chopped\O salad\O and\O fish\O and\O chips\O .\O
1300636:3	Other guests enjoyed pizza , santa fe chopped salad and fish and chips .	Other\O guests\O enjoyed\O pizza\O ,\O santa\O fe\O chopped\O salad\O and\O fish\B and\I chips\I .\O	Other\O guests\O enjoyed\B pizza\O ,\O santa\O fe\O chopped\O salad\O and\O fish\O and\O chips\O .\O
1300636:4	I highly recommend Cafe St. Bart 's for their food , the ambience and wonderful service .	I\O highly\O recommend\O Cafe\O St.\O Bart\O 's\O for\O their\O food\B ,\O the\O ambience\O and\O wonderful\O service\O .\O	I\O highly\O recommend\B Cafe\O St.\O Bart\O 's\O for\O their\O food\O ,\O the\O ambience\O and\O wonderful\O service\O .\O
1300636:4	I highly recommend Cafe St. Bart 's for their food , the ambience and wonderful service .	I\O highly\O recommend\O Cafe\O St.\O Bart\O 's\O for\O their\O food\O ,\O the\O ambience\B and\O wonderful\O service\O .\O	I\O highly\O recommend\B Cafe\O St.\O Bart\O 's\O for\O their\O food\O ,\O the\O ambience\O and\O wonderful\O service\O .\O
1300636:4	I highly recommend Cafe St. Bart 's for their food , the ambience and wonderful service .	I\O highly\O recommend\O Cafe\O St.\O Bart\O 's\O for\O their\O food\O ,\O the\O ambience\O and\O wonderful\O service\B .\O	I\O highly\O recommend\B Cafe\O St.\O Bart\O 's\O for\O their\O food\O ,\O the\O ambience\O and\O wonderful\B service\O .\O
1303888:0	All the staff is absolutely professional ! !	All\O the\O staff\B is\O absolutely\O professional\O !\O !\O	All\O the\O staff\O is\O absolutely\O professional\B !\O !\O
1303984:0	This restaurant was way overhyped .	This\O restaurant\B was\O way\O overhyped\O .\O	This\O restaurant\O was\O way\O overhyped\B .\O
1303984:1	My chow fun and chow see was really bland and oily .	My\O chow\B fun\I and\I chow\I see\I was\O really\O bland\O and\O oily\O .\O	My\O chow\O fun\O and\O chow\O see\O was\O really\O bland\B and\O oily\B .\O
1303984:3	The scallion pancakes and fried dumplings were nothing out of the ordinary .	The\O scallion\B pancakes\I and\O fried\O dumplings\O were\O nothing\O out\O of\O the\O ordinary\O .\O	The\O scallion\O pancakes\O and\O fried\O dumplings\O were\O nothing\O out\O of\O the\O ordinary\B .\O
1303984:3	The scallion pancakes and fried dumplings were nothing out of the ordinary .	The\O scallion\O pancakes\O and\O fried\B dumplings\I were\O nothing\O out\O of\O the\O ordinary\O .\O	The\O scallion\O pancakes\O and\O fried\O dumplings\O were\O nothing\O out\O of\O the\O ordinary\B .\O
1308557:0	The service was the only thing good about this restaurant .	The\O service\B was\O the\O only\O thing\O good\O about\O this\O restaurant\O .\O	The\O service\O was\O the\O only\O thing\O good\B about\O this\O restaurant\O .\O
1308557:1	It 's boring on the inside , and our sushi was pretty below average ... the tuna was soggy and the other rolls had no flavor .	It\O 's\O boring\O on\O the\O inside\O ,\O and\O our\O sushi\B was\O pretty\O below\O average\O ...\O the\O tuna\O was\O soggy\O and\O the\O other\O rolls\O had\O no\O flavor\O .\O	It\O 's\O boring\O on\O the\O inside\O ,\O and\O our\O sushi\O was\O pretty\O below\B average\I ...\O the\O tuna\O was\O soggy\O and\O the\O other\O rolls\O had\O no\O flavor\O .\O
1308557:1	It 's boring on the inside , and our sushi was pretty below average ... the tuna was soggy and the other rolls had no flavor .	It\O 's\O boring\O on\O the\O inside\O ,\O and\O our\O sushi\O was\O pretty\O below\O average\O ...\O the\O tuna\B was\O soggy\O and\O the\O other\O rolls\O had\O no\O flavor\O .\O	It\O 's\O boring\O on\O the\O inside\O ,\O and\O our\O sushi\O was\O pretty\O below\O average\O ...\O the\O tuna\O was\O soggy\B and\O the\O other\O rolls\O had\O no\O flavor\O .\O
1308557:1	It 's boring on the inside , and our sushi was pretty below average ... the tuna was soggy and the other rolls had no flavor .	It\O 's\O boring\O on\O the\O inside\O ,\O and\O our\O sushi\O was\O pretty\O below\O average\O ...\O the\O tuna\O was\O soggy\O and\O the\O other\O rolls\B had\O no\O flavor\O .\O	It\O 's\O boring\O on\O the\O inside\O ,\O and\O our\O sushi\O was\O pretty\O below\O average\O ...\O the\O tuna\O was\O soggy\O and\O the\O other\O rolls\O had\O no\B flavor\I .\O
1310217:1	Their pad penang is delicious and everything else is fantastic .	Their\O pad\B penang\I is\O delicious\O and\O everything\O else\O is\O fantastic\O .\O	Their\O pad\O penang\O is\O delicious\B and\O everything\O else\O is\O fantastic\O .\O
1310217:2	The price is reasonable although the service is poor .	The\O price\O is\O reasonable\O although\O the\O service\B is\O poor\O .\O	The\O price\O is\O reasonable\O although\O the\O service\O is\O poor\B .\O
1318537:0	fresh restaurant was amazing ... ... .. food was delicious and of course fresh .	fresh\B restaurant\I was\O amazing\O ...\O ...\O ..\O food\O was\O delicious\O and\O of\O course\O fresh\O .\O	fresh\B restaurant\O was\O amazing\B ...\O ...\O ..\O food\O was\O delicious\O and\O of\O course\O fresh\O .\O
1318537:0	fresh restaurant was amazing ... ... .. food was delicious and of course fresh .	fresh\O restaurant\O was\O amazing\O ...\O ...\O ..\O food\B was\O delicious\O and\O of\O course\O fresh\O .\O	fresh\O restaurant\O was\O amazing\O ...\O ...\O ..\O food\O was\O delicious\B and\O of\O course\O fresh\B .\O
1318537:4	Hats off to the chef .	Hats\O off\O to\O the\O chef\B .\O	Hats\B off\I to\O the\O chef\O .\O
1328078:3	the salads are delicious , both refreshing and very spicy .	the\O salads\B are\O delicious\O ,\O both\O refreshing\O and\O very\O spicy\O .\O	the\O salads\O are\O delicious\B ,\O both\O refreshing\B and\O very\O spicy\B .\O
1328078:4	We had Pam 's special fried fish and it was amazing .	We\O had\O Pam\B 's\I special\I fried\I fish\I and\O it\O was\O amazing\O .\O	We\O had\O Pam\O 's\O special\O fried\O fish\O and\O it\O was\O amazing\B .\O
1335154:1	Great vibe , lots of people .	Great\O vibe\B ,\O lots\O of\O people\O .\O	Great\B vibe\O ,\O lots\O of\O people\O .\O
1335154:4	I did n't complain , I liked the atmosphere so much .	I\O did\O n't\O complain\O ,\O I\O liked\O the\O atmosphere\B so\O much\O .\O	I\O did\O n't\O complain\O ,\O I\O liked\B the\O atmosphere\O so\O much\O .\O
1335656:2	Ambience is so cute and quaint , good for business although we were there on vacation .	Ambience\B is\O so\O cute\O and\O quaint\O ,\O good\O for\O business\O although\O we\O were\O there\O on\O vacation\O .\O	Ambience\O is\O so\O cute\B and\O quaint\B ,\O good\B for\O business\O although\O we\O were\O there\O on\O vacation\O .\O
1335656:3	Salads were fantastic .	Salads\B were\O fantastic\O .\O	Salads\O were\O fantastic\B .\O
1335656:4	Although we were looking for regular lettuce and some walnuts the salads we got were great .	Although\O we\O were\O looking\O for\O regular\O lettuce\O and\O some\O walnuts\O the\O salads\B we\O got\O were\O great\O .\O	Although\O we\O were\O looking\O for\O regular\O lettuce\O and\O some\O walnuts\O the\O salads\O we\O got\O were\O great\B .\O
1335656:5	Ingredients are organic which is a real plus for me .	Ingredients\B are\O organic\O which\O is\O a\O real\O plus\O for\O me\O .\O	Ingredients\O are\O organic\B which\O is\O a\O real\O plus\B for\O me\O .\O
1338124:0	This is some really good , inexpensive sushi .	This\O is\O some\O really\O good\O ,\O inexpensive\O sushi\B .\O	This\O is\O some\O really\O good\B ,\O inexpensive\B sushi\O .\O
1338124:2	The spicy Tuna roll is huge and probably the best that I 've had at this price range .	The\O spicy\B Tuna\I roll\I is\O huge\O and\O probably\O the\O best\O that\O I\O 've\O had\O at\O this\O price\O range\O .\O	The\O spicy\O Tuna\O roll\O is\O huge\B and\O probably\O the\O best\B that\O I\O 've\O had\O at\O this\O price\O range\O .\O
1338124:3	The Yellowtail was particularly good as well .	The\O Yellowtail\B was\O particularly\O good\O as\O well\O .\O	The\O Yellowtail\O was\O particularly\O good\B as\O well\O .\O
1338124:4	I have reservations about the all you can eat deal , however -- the choices are fairly limited and you can probably order more food than you can eat for less than $ 18 by just going off the menu .	I\O have\O reservations\O about\O the\O all\B you\I can\I eat\I deal\I ,\O however\O --\O the\O choices\O are\O fairly\O limited\O and\O you\O can\O probably\O order\O more\O food\O than\O you\O can\O eat\O for\O less\O than\O $\O 18\O by\O just\O going\O off\O the\O menu\O .\O	I\O have\O reservations\O about\O the\O all\O you\O can\O eat\O deal\O ,\O however\O --\O the\O choices\O are\O fairly\O limited\B and\O you\O can\O probably\O order\O more\O food\O than\O you\O can\O eat\O for\O less\O than\O $\O 18\O by\O just\O going\O off\O the\O menu\O .\O
1340075:0	Big Wong gets big Ups for a fine establishment .	Big\B Wong\I gets\O big\O Ups\O for\O a\O fine\O establishment\O .\O	Big\O Wong\O gets\O big\B Ups\I for\O a\O fine\B establishment\O .\O
1340075:1	They have it all -- great price , food , and service .	They\O have\O it\O all\O --\O great\O price\O ,\O food\B ,\O and\O service\O .\O	They\O have\O it\O all\O --\O great\B price\O ,\O food\O ,\O and\O service\O .\O
1340075:1	They have it all -- great price , food , and service .	They\O have\O it\O all\O --\O great\O price\O ,\O food\O ,\O and\O service\B .\O	They\O have\O it\O all\O --\O great\B price\O ,\O food\O ,\O and\O service\O .\O
1340075:2	The atmosphere is noisy and the waiters are literally walking around doing things as fast as they can .	The\O atmosphere\B is\O noisy\O and\O the\O waiters\O are\O literally\O walking\O around\O doing\O things\O as\O fast\O as\O they\O can\O .\O	The\O atmosphere\O is\O noisy\B and\O the\O waiters\O are\O literally\O walking\O around\O doing\O things\O as\O fast\O as\O they\O can\O .\O
1340075:2	The atmosphere is noisy and the waiters are literally walking around doing things as fast as they can .	The\O atmosphere\O is\O noisy\O and\O the\O waiters\B are\O literally\O walking\O around\O doing\O things\O as\O fast\O as\O they\O can\O .\O	The\O atmosphere\O is\O noisy\O and\O the\O waiters\O are\O literally\O walking\O around\O doing\O things\O as\O fast\B as\O they\O can\O .\O
1340075:5	The takeout is great too since they give high quality tupperware as well .	The\O takeout\B is\O great\O too\O since\O they\O give\O high\O quality\O tupperware\O as\O well\O .\O	The\O takeout\O is\O great\B too\O since\O they\O give\O high\O quality\O tupperware\O as\O well\O .\O
1340075:6	This place is always very crowded and popular .	This\O place\B is\O always\O very\O crowded\O and\O popular\O .\O	This\O place\O is\O always\O very\O crowded\B and\O popular\B .\O
1341354:1	Enjoyed a very nice Caesar Salad while my wife had arugula and goat cheese ... .both very tasty .	Enjoyed\O a\O very\O nice\O Caesar\B Salad\I while\O my\O wife\O had\O arugula\O and\O goat\O cheese\O ...\O .both\O very\O tasty\O .\O	Enjoyed\B a\O very\O nice\B Caesar\O Salad\O while\O my\O wife\O had\O arugula\O and\O goat\O cheese\O ...\O .both\O very\O tasty\O .\O
1341354:1	Enjoyed a very nice Caesar Salad while my wife had arugula and goat cheese ... .both very tasty .	Enjoyed\O a\O very\O nice\O Caesar\O Salad\O while\O my\O wife\O had\O arugula\B and\I goat\I cheese\I ...\O .both\O very\O tasty\O .\O	Enjoyed\O a\O very\O nice\O Caesar\O Salad\O while\O my\O wife\O had\O arugula\O and\O goat\O cheese\O ...\O .both\O very\O tasty\B .\O
1341354:2	We both opted for a pasta dish and they were served timely and fresh .	We\O both\O opted\O for\O a\O pasta\B dish\I and\O they\O were\O served\O timely\O and\O fresh\O .\O	We\O both\O opted\O for\O a\O pasta\O dish\O and\O they\O were\O served\B timely\I and\O fresh\B .\O
1341354:3	We concluded with tiramisu chocolate cake , both were delicious .	We\O concluded\O with\O tiramisu\B chocolate\I cake\I ,\O both\O were\O delicious\O .\O	We\O concluded\O with\O tiramisu\O chocolate\O cake\O ,\O both\O were\O delicious\B .\O
1347423:0	I recently went to this restaurant with some co-workers for lunch and had an amazing time .	I\O recently\O went\O to\O this\O restaurant\B with\O some\O co-workers\O for\O lunch\O and\O had\O an\O amazing\O time\O .\O	I\O recently\O went\O to\O this\O restaurant\O with\O some\O co-workers\O for\O lunch\O and\O had\O an\O amazing\B time\I .\O
1347423:1	The staff was accomodating , the food was absolutely delicious and the place is lovely .	The\O staff\B was\O accomodating\O ,\O the\O food\O was\O absolutely\O delicious\O and\O the\O place\O is\O lovely\O .\O	The\O staff\O was\O accomodating\B ,\O the\O food\O was\O absolutely\O delicious\O and\O the\O place\O is\O lovely\O .\O
1347423:1	The staff was accomodating , the food was absolutely delicious and the place is lovely .	The\O staff\O was\O accomodating\O ,\O the\O food\B was\O absolutely\O delicious\O and\O the\O place\O is\O lovely\O .\O	The\O staff\O was\O accomodating\O ,\O the\O food\O was\O absolutely\O delicious\B and\O the\O place\O is\O lovely\O .\O
1347423:1	The staff was accomodating , the food was absolutely delicious and the place is lovely .	The\O staff\O was\O accomodating\O ,\O the\O food\O was\O absolutely\O delicious\O and\O the\O place\B is\O lovely\O .\O	The\O staff\O was\O accomodating\O ,\O the\O food\O was\O absolutely\O delicious\O and\O the\O place\O is\O lovely\B .\O
1349391:0	sometimes i get good food and ok service .	sometimes\O i\O get\O good\O food\B and\O ok\O service\O .\O	sometimes\O i\O get\O good\B food\O and\O ok\O service\O .\O
1349391:0	sometimes i get good food and ok service .	sometimes\O i\O get\O good\O food\O and\O ok\O service\B .\O	sometimes\O i\O get\O good\O food\O and\O ok\B service\O .\O
1349391:1	sometimes i get bad food and bad service , sometimes i get good good and bad service .	sometimes\O i\O get\O bad\O food\B and\O bad\O service\O ,\O sometimes\O i\O get\O good\O good\O and\O bad\O service\O .\O	sometimes\O i\O get\O bad\B food\O and\O bad\O service\O ,\O sometimes\O i\O get\O good\O good\O and\O bad\O service\O .\O
1349391:1	sometimes i get bad food and bad service , sometimes i get good good and bad service .	sometimes\O i\O get\O bad\O food\O and\O bad\O service\B ,\O sometimes\O i\O get\O good\O good\O and\O bad\O service\O .\O	sometimes\O i\O get\O bad\O food\O and\O bad\B service\O ,\O sometimes\O i\O get\O good\O good\O and\O bad\O service\O .\O
1349391:1	sometimes i get bad food and bad service , sometimes i get good good and bad service .	sometimes\O i\O get\O bad\O food\O and\O bad\O service\O ,\O sometimes\O i\O get\O good\O good\B and\O bad\O service\O .\O	sometimes\O i\O get\O bad\O food\O and\O bad\O service\O ,\O sometimes\O i\O get\O good\B good\O and\O bad\O service\O .\O
1352948:0	The place is a BISTRO which means : simple dishes and wine served efficiently in a bustling atmosphere .	The\O place\O is\O a\O BISTRO\O which\O means\O :\O simple\O dishes\B and\O wine\O served\O efficiently\O in\O a\O bustling\O atmosphere\O .\O	The\O place\O is\O a\O BISTRO\O which\O means\O :\O simple\B dishes\O and\O wine\O served\O efficiently\O in\O a\O bustling\O atmosphere\O .\O
1352948:0	The place is a BISTRO which means : simple dishes and wine served efficiently in a bustling atmosphere .	The\O place\O is\O a\O BISTRO\O which\O means\O :\O simple\O dishes\O and\O wine\B served\O efficiently\O in\O a\O bustling\O atmosphere\O .\O	The\O place\O is\O a\O BISTRO\O which\O means\O :\O simple\O dishes\O and\O wine\O served\B efficiently\I in\O a\O bustling\O atmosphere\O .\O
1352948:0	The place is a BISTRO which means : simple dishes and wine served efficiently in a bustling atmosphere .	The\O place\O is\O a\O BISTRO\O which\O means\O :\O simple\O dishes\O and\O wine\O served\O efficiently\O in\O a\O bustling\O atmosphere\B .\O	The\O place\O is\O a\O BISTRO\O which\O means\O :\O simple\O dishes\O and\O wine\O served\O efficiently\O in\O a\O bustling\B atmosphere\O .\O
1352948:3	And evaluated on those terms Pastis is simply wonderful .	And\O evaluated\O on\O those\O terms\O Pastis\B is\O simply\O wonderful\O .\O	And\O evaluated\O on\O those\O terms\O Pastis\O is\O simply\O wonderful\B .\O
1353599:0	Right off the L in Brooklyn this is a nice cozy place with good pizza .	Right\O off\O the\O L\O in\O Brooklyn\O this\O is\O a\O nice\O cozy\O place\O with\O good\O pizza\B .\O	Right\O off\O the\O L\O in\O Brooklyn\O this\O is\O a\O nice\O cozy\O place\O with\O good\B pizza\O .\O
1353599:0	Right off the L in Brooklyn this is a nice cozy place with good pizza .	Right\O off\O the\O L\O in\O Brooklyn\O this\O is\O a\O nice\O cozy\O place\B with\O good\O pizza\O .\O	Right\O off\O the\O L\O in\O Brooklyn\O this\O is\O a\O nice\B cozy\B place\O with\O good\O pizza\O .\O
1353599:1	Mine was a little burnt but still delicious with goat cheese and panchetta ( raddichio was kind of bitter though ) .	Mine\O was\O a\O little\O burnt\O but\O still\O delicious\O with\O goat\O cheese\O and\O panchetta\O (\O raddichio\B was\O kind\O of\O bitter\O though\O )\O .\O	Mine\O was\O a\O little\O burnt\O but\O still\O delicious\O with\O goat\O cheese\O and\O panchetta\O (\O raddichio\O was\O kind\O of\O bitter\B though\O )\O .\O
1353599:2	My friend got the mushroom pizza which tasted better .	My\O friend\O got\O the\O mushroom\B pizza\I which\O tasted\O better\O .\O	My\O friend\O got\O the\O mushroom\O pizza\O which\O tasted\O better\B .\O
1353599:3	The sangria was pretty tasty and good on a hot muggy day .	The\O sangria\B was\O pretty\O tasty\O and\O good\O on\O a\O hot\O muggy\O day\O .\O	The\O sangria\O was\O pretty\O tasty\B and\O good\B on\O a\O hot\O muggy\O day\O .\O
1353599:4	Kind of a small place but I guess if they are not too busy might be able to fit a group or kids .	Kind\O of\O a\O small\O place\B but\O I\O guess\O if\O they\O are\O not\O too\O busy\O might\O be\O able\O to\O fit\O a\O group\O or\O kids\O .\O	Kind\O of\O a\O small\B place\O but\O I\O guess\O if\O they\O are\O not\O too\O busy\O might\O be\O able\O to\O fit\O a\O group\O or\O kids\O .\O
1357554:0	I started out with a Bombay beer which was big enough for two .	I\O started\O out\O with\O a\O Bombay\B beer\I which\O was\O big\O enough\O for\O two\O .\O	I\O started\O out\O with\O a\O Bombay\O beer\O which\O was\O big\B enough\O for\O two\O .\O
1357554:3	Service was slow , but the people were friendly .	Service\B was\O slow\O ,\O but\O the\O people\O were\O friendly\O .\O	Service\O was\O slow\B ,\O but\O the\O people\O were\O friendly\O .\O
1357554:3	Service was slow , but the people were friendly .	Service\O was\O slow\O ,\O but\O the\O people\B were\O friendly\O .\O	Service\O was\O slow\O ,\O but\O the\O people\O were\O friendly\B .\O
1357554:4	It 's a nice place to relax and have conversation .	It\O 's\O a\O nice\O place\B to\O relax\O and\O have\O conversation\O .\O	It\O 's\O a\O nice\B place\O to\O relax\O and\O have\O conversation\O .\O
1367358:1	The food is authentic Italian - delicious !	The\O food\B is\O authentic\O Italian\O -\O delicious\O !\O	The\O food\O is\O authentic\B Italian\I -\O delicious\B !\O
1367358:2	Pizza is terrific , as is homemade pasta .	Pizza\B is\O terrific\O ,\O as\O is\O homemade\O pasta\O .\O	Pizza\O is\O terrific\B ,\O as\O is\O homemade\O pasta\O .\O
1367358:2	Pizza is terrific , as is homemade pasta .	Pizza\O is\O terrific\O ,\O as\O is\O homemade\B pasta\I .\O	Pizza\O is\O terrific\B ,\O as\O is\O homemade\O pasta\O .\O
1367358:3	Ambience is delightful , service impeccable .	Ambience\B is\O delightful\O ,\O service\O impeccable\O .\O	Ambience\O is\O delightful\B ,\O service\O impeccable\O .\O
1367358:3	Ambience is delightful , service impeccable .	Ambience\O is\O delightful\O ,\O service\B impeccable\O .\O	Ambience\O is\O delightful\O ,\O service\O impeccable\B .\O
1380450:0	I 'm still mad that i had to pay for lousy food .	I\O 'm\O still\O mad\O that\O i\O had\O to\O pay\O for\O lousy\O food\B .\O	I\O 'm\O still\O mad\O that\O i\O had\O to\O pay\O for\O lousy\B food\O .\O
1380450:1	The hanger steak was like rubber and the tuna was flavorless not to mention it tasted like it had just been thawed .	The\O hanger\B steak\I was\O like\O rubber\O and\O the\O tuna\O was\O flavorless\O not\O to\O mention\O it\O tasted\O like\O it\O had\O just\O been\O thawed\O .\O	The\O hanger\O steak\O was\O like\O rubber\B and\O the\O tuna\O was\O flavorless\O not\O to\O mention\O it\O tasted\O like\O it\O had\O just\O been\O thawed\O .\O
1380450:1	The hanger steak was like rubber and the tuna was flavorless not to mention it tasted like it had just been thawed .	The\O hanger\O steak\O was\O like\O rubber\O and\O the\O tuna\B was\O flavorless\O not\O to\O mention\O it\O tasted\O like\O it\O had\O just\O been\O thawed\O .\O	The\O hanger\O steak\O was\O like\O rubber\O and\O the\O tuna\O was\O flavorless\B not\O to\O mention\O it\O tasted\O like\O it\O had\O just\O been\O thawed\O .\O
1380450:2	Service was also horrible and the ambience is not that great .	Service\B was\O also\O horrible\O and\O the\O ambience\O is\O not\O that\O great\O .\O	Service\O was\O also\O horrible\B and\O the\O ambience\O is\O not\O that\O great\O .\O
1380450:2	Service was also horrible and the ambience is not that great .	Service\O was\O also\O horrible\O and\O the\O ambience\B is\O not\O that\O great\O .\O	Service\O was\O also\O horrible\O and\O the\O ambience\O is\O not\B that\I great\I .\O
1387314:1	This is my first time writing a review for a restaurant because the food and service was excellent .	This\O is\O my\O first\O time\O writing\O a\O review\O for\O a\O restaurant\O because\O the\O food\B and\O service\O was\O excellent\O .\O	This\O is\O my\O first\O time\O writing\O a\O review\O for\O a\O restaurant\O because\O the\O food\O and\O service\O was\O excellent\B .\O
1387314:1	This is my first time writing a review for a restaurant because the food and service was excellent .	This\O is\O my\O first\O time\O writing\O a\O review\O for\O a\O restaurant\O because\O the\O food\O and\O service\B was\O excellent\O .\O	This\O is\O my\O first\O time\O writing\O a\O review\O for\O a\O restaurant\O because\O the\O food\O and\O service\O was\O excellent\B .\O
1387314:2	The filet mignon dish was superb !	The\O filet\B mignon\I dish\I was\O superb\O !\O	The\O filet\O mignon\O dish\O was\O superb\B !\O
1387314:4	It 's a small cute restaurant .	It\O 's\O a\O small\O cute\O restaurant\B .\O	It\O 's\O a\O small\B cute\B restaurant\O .\O
1390357:0	I absolutely love this place ! ! !	I\O absolutely\O love\O this\O place\B !\O !\O !\O	I\O absolutely\O love\B this\O place\O !\O !\O !\O
1390357:2	I like the ambience , it 's very dark and original .	I\O like\O the\O ambience\B ,\O it\O 's\O very\O dark\O and\O original\O .\O	I\O like\B the\O ambience\O ,\O it\O 's\O very\O dark\B and\O original\B .\O
1390357:4	The sushi is amazing ! ! !	The\O sushi\B is\O amazing\O !\O !\O !\O	The\O sushi\O is\O amazing\B !\O !\O !\O
1394712:0	Very affordable and excellent ambient !	Very\O affordable\O and\O excellent\O ambient\B !\O	Very\O affordable\B and\O excellent\B ambient\O !\O
1394712:3	We wo n't go to this place again for a good meal .	We\O wo\O n't\O go\O to\O this\O place\O again\O for\O a\O good\O meal\B .\O	We\O wo\O n't\O go\O to\O this\O place\O again\O for\O a\O good\B meal\O .\O
1394712:4	However , I think this place is a good hang out spot .	However\O ,\O I\O think\O this\O place\B is\O a\O good\O hang\O out\O spot\O .\O	However\O ,\O I\O think\O this\O place\O is\O a\O good\B hang\O out\O spot\O .\O
